
         /\      Grafana   /‾‾/  
    /\  /  \     |\  __   /  /   
   /  \/    \    | |/ /  /   ‾‾\ 
  /          \   |   (  |  (‾)  |
 / __________ \  |_|\_\  \_____/ 

     execution: local
        script: backend/tests/load/scenarios/authentication.js
        output: -

     scenarios: (100.00%) 1 scenario, 20 max VUs, 6m30s max duration (incl. graceful stop):
              * default: Up to 20 looping VUs for 6m0s over 5 stages (gracefulRampDown: 30s, gracefulStop: 30s)

time="2025-12-16T22:11:53Z" level=info msg="Starting authentication load test" source=console
time="2025-12-16T22:11:53Z" level=info msg="Target URL: http://localhost:8080" source=console
time="2025-12-16T22:11:53Z" level=info msg="Target rate: 20 authentication flows per minute" source=console
time="2025-12-16T22:11:53Z" level=info msg="\nWARNING: No AUTH_TOKEN provided" source=console
time="2025-12-16T22:11:53Z" level=info msg="Running in limited mode - testing public endpoints only" source=console
time="2025-12-16T22:11:53Z" level=info msg="For full authentication testing, provide AUTH_TOKEN:" source=console
time="2025-12-16T22:11:53Z" level=info msg="  k6 run -e AUTH_TOKEN=your_token backend/tests/load/scenarios/authentication.js" source=console

running (0m01.0s), 01/20 VUs, 0 complete and 0 interrupted iterations
default   [   0% ] 01/20 VUs  0m01.0s/6m00.0s

running (0m02.0s), 01/20 VUs, 0 complete and 0 interrupted iterations
default   [   1% ] 01/20 VUs  0m02.0s/6m00.0s

running (0m03.0s), 01/20 VUs, 0 complete and 0 interrupted iterations
default   [   1% ] 01/20 VUs  0m03.0s/6m00.0s

running (0m04.0s), 01/20 VUs, 0 complete and 0 interrupted iterations
default   [   1% ] 01/20 VUs  0m04.0s/6m00.0s

running (0m05.0s), 01/20 VUs, 1 complete and 0 interrupted iterations
default   [   1% ] 01/20 VUs  0m05.0s/6m00.0s

running (0m06.0s), 01/20 VUs, 1 complete and 0 interrupted iterations
default   [   2% ] 01/20 VUs  0m06.0s/6m00.0s

running (0m07.0s), 01/20 VUs, 1 complete and 0 interrupted iterations
default   [   2% ] 01/20 VUs  0m07.0s/6m00.0s

running (0m08.0s), 02/20 VUs, 2 complete and 0 interrupted iterations
default   [   2% ] 02/20 VUs  0m08.0s/6m00.0s

running (0m09.0s), 02/20 VUs, 2 complete and 0 interrupted iterations
default   [   2% ] 02/20 VUs  0m09.0s/6m00.0s

running (0m10.0s), 02/20 VUs, 2 complete and 0 interrupted iterations
default   [   3% ] 02/20 VUs  0m10.0s/6m00.0s

running (0m11.0s), 02/20 VUs, 2 complete and 0 interrupted iterations
default   [   3% ] 02/20 VUs  0m11.0s/6m00.0s

running (0m12.0s), 02/20 VUs, 4 complete and 0 interrupted iterations
default   [   3% ] 02/20 VUs  0m12.0s/6m00.0s

running (0m13.0s), 02/20 VUs, 4 complete and 0 interrupted iterations
default   [   4% ] 02/20 VUs  0m13.0s/6m00.0s

running (0m14.0s), 02/20 VUs, 4 complete and 0 interrupted iterations
default   [   4% ] 02/20 VUs  0m14.0s/6m00.0s

running (0m15.0s), 02/20 VUs, 6 complete and 0 interrupted iterations
default   [   4% ] 02/20 VUs  0m15.0s/6m00.0s

running (0m16.0s), 03/20 VUs, 6 complete and 0 interrupted iterations
default   [   4% ] 03/20 VUs  0m16.0s/6m00.0s

running (0m17.0s), 03/20 VUs, 7 complete and 0 interrupted iterations
default   [   5% ] 03/20 VUs  0m17.0s/6m00.0s

running (0m18.0s), 03/20 VUs, 9 complete and 0 interrupted iterations
default   [   5% ] 03/20 VUs  0m18.0s/6m00.0s

running (0m19.0s), 03/20 VUs, 9 complete and 0 interrupted iterations
default   [   5% ] 03/20 VUs  0m19.0s/6m00.0s

running (0m20.0s), 03/20 VUs, 10 complete and 0 interrupted iterations
default   [   6% ] 03/20 VUs  0m20.0s/6m00.0s

running (0m21.0s), 03/20 VUs, 11 complete and 0 interrupted iterations
default   [   6% ] 03/20 VUs  0m21.0s/6m00.0s

running (0m22.0s), 03/20 VUs, 12 complete and 0 interrupted iterations
default   [   6% ] 03/20 VUs  0m22.0s/6m00.0s

running (0m23.0s), 04/20 VUs, 12 complete and 0 interrupted iterations
default   [   6% ] 04/20 VUs  0m23.0s/6m00.0s

running (0m24.0s), 04/20 VUs, 12 complete and 0 interrupted iterations
default   [   7% ] 04/20 VUs  0m24.0s/6m00.0s

running (0m25.0s), 04/20 VUs, 14 complete and 0 interrupted iterations
default   [   7% ] 04/20 VUs  0m25.0s/6m00.0s

running (0m26.0s), 04/20 VUs, 15 complete and 0 interrupted iterations
default   [   7% ] 04/20 VUs  0m26.0s/6m00.0s

running (0m27.0s), 04/20 VUs, 18 complete and 0 interrupted iterations
default   [   7% ] 04/20 VUs  0m27.0s/6m00.0s

running (0m28.0s), 04/20 VUs, 18 complete and 0 interrupted iterations
default   [   8% ] 04/20 VUs  0m28.0s/6m00.0s

running (0m29.0s), 04/20 VUs, 20 complete and 0 interrupted iterations
default   [   8% ] 04/20 VUs  0m29.0s/6m00.0s

running (0m30.0s), 04/20 VUs, 22 complete and 0 interrupted iterations
default   [   8% ] 04/20 VUs  0m30.0s/6m00.0s

running (0m31.0s), 05/20 VUs, 22 complete and 0 interrupted iterations
default   [   9% ] 05/20 VUs  0m31.0s/6m00.0s

running (0m32.0s), 05/20 VUs, 24 complete and 0 interrupted iterations
default   [   9% ] 05/20 VUs  0m32.0s/6m00.0s

running (0m33.0s), 05/20 VUs, 26 complete and 0 interrupted iterations
default   [   9% ] 05/20 VUs  0m33.0s/6m00.0s

running (0m34.0s), 05/20 VUs, 27 complete and 0 interrupted iterations
default   [   9% ] 05/20 VUs  0m34.0s/6m00.0s

running (0m35.0s), 05/20 VUs, 28 complete and 0 interrupted iterations
default   [  10% ] 05/20 VUs  0m35.0s/6m00.0s

running (0m36.0s), 05/20 VUs, 30 complete and 0 interrupted iterations
default   [  10% ] 05/20 VUs  0m36.0s/6m00.0s

running (0m37.0s), 05/20 VUs, 32 complete and 0 interrupted iterations
default   [  10% ] 05/20 VUs  0m37.0s/6m00.0s

running (0m38.0s), 05/20 VUs, 32 complete and 0 interrupted iterations
default   [  11% ] 05/20 VUs  0m38.0s/6m00.0s

running (0m39.0s), 05/20 VUs, 34 complete and 0 interrupted iterations
default   [  11% ] 05/20 VUs  0m39.0s/6m00.0s

running (0m40.0s), 05/20 VUs, 35 complete and 0 interrupted iterations
default   [  11% ] 05/20 VUs  0m40.0s/6m00.0s

running (0m41.0s), 05/20 VUs, 36 complete and 0 interrupted iterations
default   [  11% ] 05/20 VUs  0m41.0s/6m00.0s

running (0m42.0s), 05/20 VUs, 38 complete and 0 interrupted iterations
default   [  12% ] 05/20 VUs  0m42.0s/6m00.0s

running (0m43.0s), 06/20 VUs, 39 complete and 0 interrupted iterations
default   [  12% ] 06/20 VUs  0m43.0s/6m00.0s

running (0m44.0s), 06/20 VUs, 41 complete and 0 interrupted iterations
default   [  12% ] 06/20 VUs  0m44.0s/6m00.0s

running (0m45.0s), 06/20 VUs, 44 complete and 0 interrupted iterations
default   [  12% ] 06/20 VUs  0m45.0s/6m00.0s

running (0m46.0s), 06/20 VUs, 45 complete and 0 interrupted iterations
default   [  13% ] 06/20 VUs  0m46.0s/6m00.0s

running (0m47.0s), 06/20 VUs, 45 complete and 0 interrupted iterations
default   [  13% ] 06/20 VUs  0m47.0s/6m00.0s

running (0m48.0s), 06/20 VUs, 48 complete and 0 interrupted iterations
default   [  13% ] 06/20 VUs  0m48.0s/6m00.0s

running (0m49.0s), 06/20 VUs, 49 complete and 0 interrupted iterations
default   [  14% ] 06/20 VUs  0m49.0s/6m00.0s

running (0m50.0s), 06/20 VUs, 50 complete and 0 interrupted iterations
default   [  14% ] 06/20 VUs  0m50.0s/6m00.0s

running (0m51.0s), 06/20 VUs, 53 complete and 0 interrupted iterations
default   [  14% ] 06/20 VUs  0m51.0s/6m00.0s

running (0m52.0s), 06/20 VUs, 54 complete and 0 interrupted iterations
default   [  14% ] 06/20 VUs  0m52.0s/6m00.0s

running (0m53.0s), 06/20 VUs, 55 complete and 0 interrupted iterations
default   [  15% ] 06/20 VUs  0m53.0s/6m00.0s

running (0m54.0s), 06/20 VUs, 56 complete and 0 interrupted iterations
default   [  15% ] 06/20 VUs  0m54.0s/6m00.0s

running (0m55.0s), 07/20 VUs, 60 complete and 0 interrupted iterations
default   [  15% ] 07/20 VUs  0m55.0s/6m00.0s

running (0m56.0s), 07/20 VUs, 60 complete and 0 interrupted iterations
default   [  16% ] 07/20 VUs  0m56.0s/6m00.0s

running (0m57.0s), 07/20 VUs, 64 complete and 0 interrupted iterations
default   [  16% ] 07/20 VUs  0m57.0s/6m00.0s

running (0m58.0s), 07/20 VUs, 65 complete and 0 interrupted iterations
default   [  16% ] 07/20 VUs  0m58.0s/6m00.0s

running (0m59.0s), 07/20 VUs, 67 complete and 0 interrupted iterations
default   [  16% ] 07/20 VUs  0m59.0s/6m00.0s

running (1m00.0s), 07/20 VUs, 70 complete and 0 interrupted iterations
default   [  17% ] 07/20 VUs  1m00.0s/6m00.0s

running (1m01.0s), 07/20 VUs, 71 complete and 0 interrupted iterations
default   [  17% ] 07/20 VUs  1m01.0s/6m00.0s

running (1m02.0s), 07/20 VUs, 75 complete and 0 interrupted iterations
default   [  17% ] 07/20 VUs  1m02.0s/6m00.0s

running (1m03.0s), 07/20 VUs, 76 complete and 0 interrupted iterations
default   [  17% ] 07/20 VUs  1m03.0s/6m00.0s

running (1m04.0s), 07/20 VUs, 76 complete and 0 interrupted iterations
default   [  18% ] 07/20 VUs  1m04.0s/6m00.0s

running (1m05.0s), 07/20 VUs, 79 complete and 0 interrupted iterations
default   [  18% ] 07/20 VUs  1m05.0s/6m00.0s

running (1m06.0s), 07/20 VUs, 80 complete and 0 interrupted iterations
default   [  18% ] 07/20 VUs  1m06.0s/6m00.0s

running (1m07.0s), 08/20 VUs, 82 complete and 0 interrupted iterations
default   [  19% ] 08/20 VUs  1m07.0s/6m00.0s

running (1m08.0s), 08/20 VUs, 83 complete and 0 interrupted iterations
default   [  19% ] 08/20 VUs  1m08.0s/6m00.0s

running (1m09.0s), 08/20 VUs, 87 complete and 0 interrupted iterations
default   [  19% ] 08/20 VUs  1m09.0s/6m00.0s

running (1m10.0s), 08/20 VUs, 89 complete and 0 interrupted iterations
default   [  19% ] 08/20 VUs  1m10.0s/6m00.0s

running (1m11.0s), 08/20 VUs, 92 complete and 0 interrupted iterations
default   [  20% ] 08/20 VUs  1m11.0s/6m00.0s

running (1m12.0s), 08/20 VUs, 95 complete and 0 interrupted iterations
default   [  20% ] 08/20 VUs  1m12.0s/6m00.0s

running (1m13.0s), 08/20 VUs, 97 complete and 0 interrupted iterations
default   [  20% ] 08/20 VUs  1m13.0s/6m00.0s

running (1m14.0s), 08/20 VUs, 98 complete and 0 interrupted iterations
default   [  21% ] 08/20 VUs  1m14.0s/6m00.0s

running (1m15.0s), 08/20 VUs, 101 complete and 0 interrupted iterations
default   [  21% ] 08/20 VUs  1m15.0s/6m00.0s

running (1m16.0s), 08/20 VUs, 103 complete and 0 interrupted iterations
default   [  21% ] 08/20 VUs  1m16.0s/6m00.0s

running (1m17.0s), 08/20 VUs, 106 complete and 0 interrupted iterations
default   [  21% ] 08/20 VUs  1m17.0s/6m00.0s

running (1m18.0s), 08/20 VUs, 106 complete and 0 interrupted iterations
default   [  22% ] 08/20 VUs  1m18.0s/6m00.0s

running (1m19.0s), 09/20 VUs, 110 complete and 0 interrupted iterations
default   [  22% ] 09/20 VUs  1m19.0s/6m00.0s

running (1m20.0s), 09/20 VUs, 113 complete and 0 interrupted iterations
default   [  22% ] 09/20 VUs  1m20.0s/6m00.0s

running (1m21.0s), 09/20 VUs, 113 complete and 0 interrupted iterations
default   [  22% ] 09/20 VUs  1m21.0s/6m00.0s

running (1m22.0s), 09/20 VUs, 116 complete and 0 interrupted iterations
default   [  23% ] 09/20 VUs  1m22.0s/6m00.0s

running (1m23.0s), 09/20 VUs, 119 complete and 0 interrupted iterations
default   [  23% ] 09/20 VUs  1m23.0s/6m00.0s

running (1m24.0s), 09/20 VUs, 122 complete and 0 interrupted iterations
default   [  23% ] 09/20 VUs  1m24.0s/6m00.0s

running (1m25.0s), 09/20 VUs, 125 complete and 0 interrupted iterations
default   [  24% ] 09/20 VUs  1m25.0s/6m00.0s

running (1m26.0s), 09/20 VUs, 127 complete and 0 interrupted iterations
default   [  24% ] 09/20 VUs  1m26.0s/6m00.0s

running (1m27.0s), 09/20 VUs, 131 complete and 0 interrupted iterations
default   [  24% ] 09/20 VUs  1m27.0s/6m00.0s

running (1m28.0s), 09/20 VUs, 133 complete and 0 interrupted iterations
default   [  24% ] 09/20 VUs  1m28.0s/6m00.0s

running (1m29.0s), 09/20 VUs, 137 complete and 0 interrupted iterations
default   [  25% ] 09/20 VUs  1m29.0s/6m00.0s

running (1m30.0s), 09/20 VUs, 138 complete and 0 interrupted iterations
default   [  25% ] 09/20 VUs  1m30.0s/6m00.0s

running (1m31.0s), 10/20 VUs, 141 complete and 0 interrupted iterations
default   [  25% ] 10/20 VUs  1m31.0s/6m00.0s

running (1m32.0s), 10/20 VUs, 144 complete and 0 interrupted iterations
default   [  26% ] 10/20 VUs  1m32.0s/6m00.0s

running (1m33.0s), 10/20 VUs, 145 complete and 0 interrupted iterations
default   [  26% ] 10/20 VUs  1m33.0s/6m00.0s

running (1m34.0s), 10/20 VUs, 147 complete and 0 interrupted iterations
default   [  26% ] 10/20 VUs  1m34.0s/6m00.0s

running (1m35.0s), 10/20 VUs, 149 complete and 0 interrupted iterations
default   [  26% ] 10/20 VUs  1m35.0s/6m00.0s

running (1m36.0s), 10/20 VUs, 154 complete and 0 interrupted iterations
default   [  27% ] 10/20 VUs  1m36.0s/6m00.0s

running (1m37.0s), 10/20 VUs, 155 complete and 0 interrupted iterations
default   [  27% ] 10/20 VUs  1m37.0s/6m00.0s

running (1m38.0s), 10/20 VUs, 158 complete and 0 interrupted iterations
default   [  27% ] 10/20 VUs  1m38.0s/6m00.0s

running (1m39.0s), 10/20 VUs, 161 complete and 0 interrupted iterations
default   [  27% ] 10/20 VUs  1m39.0s/6m00.0s

running (1m40.0s), 10/20 VUs, 164 complete and 0 interrupted iterations
default   [  28% ] 10/20 VUs  1m40.0s/6m00.0s

running (1m41.0s), 10/20 VUs, 167 complete and 0 interrupted iterations
default   [  28% ] 10/20 VUs  1m41.0s/6m00.0s

running (1m42.0s), 10/20 VUs, 170 complete and 0 interrupted iterations
default   [  28% ] 10/20 VUs  1m42.0s/6m00.0s

running (1m43.0s), 11/20 VUs, 172 complete and 0 interrupted iterations
default   [  29% ] 11/20 VUs  1m43.0s/6m00.0s

running (1m44.0s), 11/20 VUs, 175 complete and 0 interrupted iterations
default   [  29% ] 11/20 VUs  1m44.0s/6m00.0s

running (1m45.0s), 11/20 VUs, 178 complete and 0 interrupted iterations
default   [  29% ] 11/20 VUs  1m45.0s/6m00.0s

running (1m46.0s), 11/20 VUs, 182 complete and 0 interrupted iterations
default   [  29% ] 11/20 VUs  1m46.0s/6m00.0s

running (1m47.0s), 11/20 VUs, 184 complete and 0 interrupted iterations
default   [  30% ] 11/20 VUs  1m47.0s/6m00.0s

running (1m48.0s), 11/20 VUs, 186 complete and 0 interrupted iterations
default   [  30% ] 11/20 VUs  1m48.0s/6m00.0s

running (1m49.0s), 11/20 VUs, 188 complete and 0 interrupted iterations
default   [  30% ] 11/20 VUs  1m49.0s/6m00.0s

running (1m50.0s), 11/20 VUs, 194 complete and 0 interrupted iterations
default   [  31% ] 11/20 VUs  1m50.0s/6m00.0s

running (1m51.0s), 11/20 VUs, 195 complete and 0 interrupted iterations
default   [  31% ] 11/20 VUs  1m51.0s/6m00.0s

running (1m52.0s), 11/20 VUs, 198 complete and 0 interrupted iterations
default   [  31% ] 11/20 VUs  1m52.0s/6m00.0s

running (1m53.0s), 11/20 VUs, 203 complete and 0 interrupted iterations
default   [  31% ] 11/20 VUs  1m53.0s/6m00.0s

running (1m54.0s), 11/20 VUs, 205 complete and 0 interrupted iterations
default   [  32% ] 11/20 VUs  1m54.0s/6m00.0s

running (1m55.0s), 12/20 VUs, 209 complete and 0 interrupted iterations
default   [  32% ] 12/20 VUs  1m55.0s/6m00.0s

running (1m56.0s), 12/20 VUs, 214 complete and 0 interrupted iterations
default   [  32% ] 12/20 VUs  1m56.0s/6m00.0s

running (1m57.0s), 12/20 VUs, 216 complete and 0 interrupted iterations
default   [  32% ] 12/20 VUs  1m57.0s/6m00.0s

running (1m58.0s), 12/20 VUs, 220 complete and 0 interrupted iterations
default   [  33% ] 12/20 VUs  1m58.0s/6m00.0s

running (1m59.0s), 12/20 VUs, 221 complete and 0 interrupted iterations
default   [  33% ] 12/20 VUs  1m59.0s/6m00.0s

running (2m00.0s), 12/20 VUs, 227 complete and 0 interrupted iterations
default   [  33% ] 12/20 VUs  2m00.0s/6m00.0s

running (2m01.0s), 12/20 VUs, 228 complete and 0 interrupted iterations
default   [  34% ] 12/20 VUs  2m01.0s/6m00.0s

running (2m02.0s), 12/20 VUs, 232 complete and 0 interrupted iterations
default   [  34% ] 12/20 VUs  2m02.0s/6m00.0s

running (2m03.0s), 12/20 VUs, 234 complete and 0 interrupted iterations
default   [  34% ] 12/20 VUs  2m03.0s/6m00.0s

running (2m04.0s), 12/20 VUs, 239 complete and 0 interrupted iterations
default   [  34% ] 12/20 VUs  2m04.0s/6m00.0s

running (2m05.0s), 12/20 VUs, 243 complete and 0 interrupted iterations
default   [  35% ] 12/20 VUs  2m05.0s/6m00.0s

running (2m06.0s), 12/20 VUs, 246 complete and 0 interrupted iterations
default   [  35% ] 12/20 VUs  2m06.0s/6m00.0s

running (2m07.0s), 13/20 VUs, 251 complete and 0 interrupted iterations
default   [  35% ] 13/20 VUs  2m07.0s/6m00.0s

running (2m08.0s), 13/20 VUs, 253 complete and 0 interrupted iterations
default   [  36% ] 13/20 VUs  2m08.0s/6m00.0s

running (2m09.0s), 13/20 VUs, 257 complete and 0 interrupted iterations
default   [  36% ] 13/20 VUs  2m09.0s/6m00.0s

running (2m10.0s), 13/20 VUs, 261 complete and 0 interrupted iterations
default   [  36% ] 13/20 VUs  2m10.0s/6m00.0s

running (2m11.0s), 13/20 VUs, 263 complete and 0 interrupted iterations
default   [  36% ] 13/20 VUs  2m11.0s/6m00.0s

running (2m12.0s), 13/20 VUs, 270 complete and 0 interrupted iterations
default   [  37% ] 13/20 VUs  2m12.0s/6m00.0s

running (2m13.0s), 13/20 VUs, 274 complete and 0 interrupted iterations
default   [  37% ] 13/20 VUs  2m13.0s/6m00.0s

running (2m14.0s), 13/20 VUs, 276 complete and 0 interrupted iterations
default   [  37% ] 13/20 VUs  2m14.0s/6m00.0s

running (2m15.0s), 13/20 VUs, 278 complete and 0 interrupted iterations
default   [  37% ] 13/20 VUs  2m15.0s/6m00.0s

running (2m16.0s), 13/20 VUs, 284 complete and 0 interrupted iterations
default   [  38% ] 13/20 VUs  2m16.0s/6m00.0s

running (2m17.0s), 13/20 VUs, 287 complete and 0 interrupted iterations
default   [  38% ] 13/20 VUs  2m17.0s/6m00.0s

running (2m18.0s), 13/20 VUs, 291 complete and 0 interrupted iterations
default   [  38% ] 13/20 VUs  2m18.0s/6m00.0s

running (2m19.0s), 14/20 VUs, 294 complete and 0 interrupted iterations
default   [  39% ] 14/20 VUs  2m19.0s/6m00.0s

running (2m20.0s), 14/20 VUs, 295 complete and 0 interrupted iterations
default   [  39% ] 14/20 VUs  2m20.0s/6m00.0s

running (2m21.0s), 14/20 VUs, 302 complete and 0 interrupted iterations
default   [  39% ] 14/20 VUs  2m21.0s/6m00.0s

running (2m22.0s), 14/20 VUs, 307 complete and 0 interrupted iterations
default   [  39% ] 14/20 VUs  2m22.0s/6m00.0s

running (2m23.0s), 14/20 VUs, 310 complete and 0 interrupted iterations
default   [  40% ] 14/20 VUs  2m23.0s/6m00.0s

running (2m24.0s), 14/20 VUs, 312 complete and 0 interrupted iterations
default   [  40% ] 14/20 VUs  2m24.0s/6m00.0s

running (2m25.0s), 14/20 VUs, 319 complete and 0 interrupted iterations
default   [  40% ] 14/20 VUs  2m25.0s/6m00.0s

running (2m26.0s), 14/20 VUs, 323 complete and 0 interrupted iterations
default   [  41% ] 14/20 VUs  2m26.0s/6m00.0s

running (2m27.0s), 14/20 VUs, 326 complete and 0 interrupted iterations
default   [  41% ] 14/20 VUs  2m27.0s/6m00.0s

running (2m28.0s), 14/20 VUs, 330 complete and 0 interrupted iterations
default   [  41% ] 14/20 VUs  2m28.0s/6m00.0s

running (2m29.0s), 14/20 VUs, 334 complete and 0 interrupted iterations
default   [  41% ] 14/20 VUs  2m29.0s/6m00.0s

running (2m30.0s), 14/20 VUs, 338 complete and 0 interrupted iterations
default   [  42% ] 14/20 VUs  2m30.0s/6m00.0s

running (2m31.0s), 15/20 VUs, 342 complete and 0 interrupted iterations
default   [  42% ] 15/20 VUs  2m31.0s/6m00.0s

running (2m32.0s), 15/20 VUs, 345 complete and 0 interrupted iterations
default   [  42% ] 15/20 VUs  2m32.0s/6m00.0s

running (2m33.0s), 15/20 VUs, 351 complete and 0 interrupted iterations
default   [  42% ] 15/20 VUs  2m33.0s/6m00.0s

running (2m34.0s), 15/20 VUs, 356 complete and 0 interrupted iterations
default   [  43% ] 15/20 VUs  2m34.0s/6m00.0s

running (2m35.0s), 15/20 VUs, 360 complete and 0 interrupted iterations
default   [  43% ] 15/20 VUs  2m35.0s/6m00.0s

running (2m36.0s), 15/20 VUs, 363 complete and 0 interrupted iterations
default   [  43% ] 15/20 VUs  2m36.0s/6m00.0s

running (2m37.0s), 15/20 VUs, 368 complete and 0 interrupted iterations
default   [  44% ] 15/20 VUs  2m37.0s/6m00.0s

running (2m38.0s), 15/20 VUs, 372 complete and 0 interrupted iterations
default   [  44% ] 15/20 VUs  2m38.0s/6m00.0s

running (2m39.0s), 15/20 VUs, 378 complete and 0 interrupted iterations
default   [  44% ] 15/20 VUs  2m39.0s/6m00.0s

running (2m40.0s), 15/20 VUs, 381 complete and 0 interrupted iterations
default   [  44% ] 15/20 VUs  2m40.0s/6m00.0s

running (2m41.0s), 15/20 VUs, 386 complete and 0 interrupted iterations
default   [  45% ] 15/20 VUs  2m41.0s/6m00.0s

running (2m42.0s), 15/20 VUs, 391 complete and 0 interrupted iterations
default   [  45% ] 15/20 VUs  2m42.0s/6m00.0s

running (2m43.0s), 16/20 VUs, 393 complete and 0 interrupted iterations
default   [  45% ] 16/20 VUs  2m43.0s/6m00.0s

running (2m44.0s), 16/20 VUs, 397 complete and 0 interrupted iterations
default   [  46% ] 16/20 VUs  2m44.0s/6m00.0s

running (2m45.0s), 16/20 VUs, 401 complete and 0 interrupted iterations
default   [  46% ] 16/20 VUs  2m45.0s/6m00.0s

running (2m46.0s), 16/20 VUs, 408 complete and 0 interrupted iterations
default   [  46% ] 16/20 VUs  2m46.0s/6m00.0s

running (2m47.0s), 16/20 VUs, 413 complete and 0 interrupted iterations
default   [  46% ] 16/20 VUs  2m47.0s/6m00.0s

running (2m48.0s), 16/20 VUs, 418 complete and 0 interrupted iterations
default   [  47% ] 16/20 VUs  2m48.0s/6m00.0s

running (2m49.0s), 16/20 VUs, 421 complete and 0 interrupted iterations
default   [  47% ] 16/20 VUs  2m49.0s/6m00.0s

running (2m50.0s), 16/20 VUs, 427 complete and 0 interrupted iterations
default   [  47% ] 16/20 VUs  2m50.0s/6m00.0s

running (2m51.0s), 16/20 VUs, 431 complete and 0 interrupted iterations
default   [  47% ] 16/20 VUs  2m51.0s/6m00.0s

running (2m52.0s), 16/20 VUs, 435 complete and 0 interrupted iterations
default   [  48% ] 16/20 VUs  2m52.0s/6m00.0s

running (2m53.0s), 16/20 VUs, 437 complete and 0 interrupted iterations
default   [  48% ] 16/20 VUs  2m53.0s/6m00.0s

running (2m54.0s), 16/20 VUs, 443 complete and 0 interrupted iterations
default   [  48% ] 16/20 VUs  2m54.0s/6m00.0s

running (2m55.0s), 17/20 VUs, 450 complete and 0 interrupted iterations
default   [  49% ] 17/20 VUs  2m55.0s/6m00.0s

running (2m56.0s), 17/20 VUs, 452 complete and 0 interrupted iterations
default   [  49% ] 17/20 VUs  2m56.0s/6m00.0s

running (2m57.0s), 17/20 VUs, 460 complete and 0 interrupted iterations
default   [  49% ] 17/20 VUs  2m57.0s/6m00.0s

running (2m58.0s), 17/20 VUs, 462 complete and 0 interrupted iterations
default   [  49% ] 17/20 VUs  2m58.0s/6m00.0s

running (2m59.0s), 17/20 VUs, 465 complete and 0 interrupted iterations
default   [  50% ] 17/20 VUs  2m59.0s/6m00.0s

running (3m00.0s), 17/20 VUs, 470 complete and 0 interrupted iterations
default   [  50% ] 17/20 VUs  3m00.0s/6m00.0s

running (3m01.0s), 17/20 VUs, 476 complete and 0 interrupted iterations
default   [  50% ] 17/20 VUs  3m01.0s/6m00.0s

running (3m02.0s), 17/20 VUs, 480 complete and 0 interrupted iterations
default   [  51% ] 17/20 VUs  3m02.0s/6m00.0s

running (3m03.0s), 17/20 VUs, 485 complete and 0 interrupted iterations
default   [  51% ] 17/20 VUs  3m03.0s/6m00.0s

running (3m04.0s), 17/20 VUs, 490 complete and 0 interrupted iterations
default   [  51% ] 17/20 VUs  3m04.0s/6m00.0s

running (3m05.0s), 17/20 VUs, 496 complete and 0 interrupted iterations
default   [  51% ] 17/20 VUs  3m05.0s/6m00.0s

running (3m06.0s), 17/20 VUs, 500 complete and 0 interrupted iterations
default   [  52% ] 17/20 VUs  3m06.0s/6m00.0s

running (3m07.0s), 18/20 VUs, 503 complete and 0 interrupted iterations
default   [  52% ] 18/20 VUs  3m07.0s/6m00.0s

running (3m08.0s), 18/20 VUs, 506 complete and 0 interrupted iterations
default   [  52% ] 18/20 VUs  3m08.0s/6m00.0s

running (3m09.0s), 18/20 VUs, 516 complete and 0 interrupted iterations
default   [  52% ] 18/20 VUs  3m09.0s/6m00.0s

running (3m10.0s), 18/20 VUs, 520 complete and 0 interrupted iterations
default   [  53% ] 18/20 VUs  3m10.0s/6m00.0s

running (3m11.0s), 18/20 VUs, 526 complete and 0 interrupted iterations
default   [  53% ] 18/20 VUs  3m11.0s/6m00.0s

running (3m12.0s), 18/20 VUs, 531 complete and 0 interrupted iterations
default   [  53% ] 18/20 VUs  3m12.0s/6m00.0s

running (3m13.0s), 18/20 VUs, 535 complete and 0 interrupted iterations
default   [  54% ] 18/20 VUs  3m13.0s/6m00.0s

running (3m14.0s), 18/20 VUs, 539 complete and 0 interrupted iterations
default   [  54% ] 18/20 VUs  3m14.0s/6m00.0s

running (3m15.0s), 18/20 VUs, 544 complete and 0 interrupted iterations
default   [  54% ] 18/20 VUs  3m15.0s/6m00.0s

running (3m16.0s), 18/20 VUs, 553 complete and 0 interrupted iterations
default   [  54% ] 18/20 VUs  3m16.0s/6m00.0s

running (3m17.0s), 18/20 VUs, 557 complete and 0 interrupted iterations
default   [  55% ] 18/20 VUs  3m17.0s/6m00.0s

running (3m18.0s), 18/20 VUs, 564 complete and 0 interrupted iterations
default   [  55% ] 18/20 VUs  3m18.0s/6m00.0s

running (3m19.0s), 19/20 VUs, 568 complete and 0 interrupted iterations
default   [  55% ] 19/20 VUs  3m19.0s/6m00.0s

running (3m20.0s), 19/20 VUs, 570 complete and 0 interrupted iterations
default   [  56% ] 19/20 VUs  3m20.0s/6m00.0s

running (3m21.0s), 19/20 VUs, 581 complete and 0 interrupted iterations
default   [  56% ] 19/20 VUs  3m21.0s/6m00.0s

running (3m22.0s), 19/20 VUs, 585 complete and 0 interrupted iterations
default   [  56% ] 19/20 VUs  3m22.0s/6m00.0s

running (3m23.0s), 19/20 VUs, 590 complete and 0 interrupted iterations
default   [  56% ] 19/20 VUs  3m23.0s/6m00.0s

running (3m24.0s), 19/20 VUs, 596 complete and 0 interrupted iterations
default   [  57% ] 19/20 VUs  3m24.0s/6m00.0s

running (3m25.0s), 19/20 VUs, 600 complete and 0 interrupted iterations
default   [  57% ] 19/20 VUs  3m25.0s/6m00.0s

running (3m26.0s), 19/20 VUs, 607 complete and 0 interrupted iterations
default   [  57% ] 19/20 VUs  3m26.0s/6m00.0s

running (3m27.0s), 19/20 VUs, 614 complete and 0 interrupted iterations
default   [  57% ] 19/20 VUs  3m27.0s/6m00.0s

running (3m28.0s), 19/20 VUs, 617 complete and 0 interrupted iterations
default   [  58% ] 19/20 VUs  3m28.0s/6m00.0s

running (3m29.0s), 19/20 VUs, 624 complete and 0 interrupted iterations
default   [  58% ] 19/20 VUs  3m29.0s/6m00.0s

running (3m30.0s), 19/20 VUs, 631 complete and 0 interrupted iterations
default   [  58% ] 19/20 VUs  3m30.0s/6m00.0s

running (3m31.0s), 20/20 VUs, 636 complete and 0 interrupted iterations
default   [  59% ] 20/20 VUs  3m31.0s/6m00.0s

running (3m32.0s), 20/20 VUs, 640 complete and 0 interrupted iterations
default   [  59% ] 20/20 VUs  3m32.0s/6m00.0s

running (3m33.0s), 20/20 VUs, 647 complete and 0 interrupted iterations
default   [  59% ] 20/20 VUs  3m33.0s/6m00.0s

running (3m34.0s), 20/20 VUs, 652 complete and 0 interrupted iterations
default   [  59% ] 20/20 VUs  3m34.0s/6m00.0s

running (3m35.0s), 20/20 VUs, 659 complete and 0 interrupted iterations
default   [  60% ] 20/20 VUs  3m35.0s/6m00.0s

running (3m36.0s), 20/20 VUs, 662 complete and 0 interrupted iterations
default   [  60% ] 20/20 VUs  3m36.0s/6m00.0s

running (3m37.0s), 20/20 VUs, 669 complete and 0 interrupted iterations
default   [  60% ] 20/20 VUs  3m37.0s/6m00.0s

running (3m38.0s), 20/20 VUs, 674 complete and 0 interrupted iterations
default   [  61% ] 20/20 VUs  3m38.0s/6m00.0s

running (3m39.0s), 20/20 VUs, 682 complete and 0 interrupted iterations
default   [  61% ] 20/20 VUs  3m39.0s/6m00.0s

running (3m40.0s), 20/20 VUs, 688 complete and 0 interrupted iterations
default   [  61% ] 20/20 VUs  3m40.0s/6m00.0s

running (3m41.0s), 20/20 VUs, 695 complete and 0 interrupted iterations
default   [  61% ] 20/20 VUs  3m41.0s/6m00.0s

running (3m42.0s), 20/20 VUs, 698 complete and 0 interrupted iterations
default   [  62% ] 20/20 VUs  3m42.0s/6m00.0s

running (3m43.0s), 20/20 VUs, 703 complete and 0 interrupted iterations
default   [  62% ] 20/20 VUs  3m43.0s/6m00.0s

running (3m44.0s), 20/20 VUs, 714 complete and 0 interrupted iterations
default   [  62% ] 20/20 VUs  3m44.0s/6m00.0s

running (3m45.0s), 20/20 VUs, 716 complete and 0 interrupted iterations
default   [  62% ] 20/20 VUs  3m45.0s/6m00.0s

running (3m46.0s), 20/20 VUs, 720 complete and 0 interrupted iterations
default   [  63% ] 20/20 VUs  3m46.0s/6m00.0s

running (3m47.0s), 20/20 VUs, 729 complete and 0 interrupted iterations
default   [  63% ] 20/20 VUs  3m47.0s/6m00.0s

running (3m48.0s), 20/20 VUs, 735 complete and 0 interrupted iterations
default   [  63% ] 20/20 VUs  3m48.0s/6m00.0s

running (3m49.0s), 20/20 VUs, 742 complete and 0 interrupted iterations
default   [  64% ] 20/20 VUs  3m49.0s/6m00.0s

running (3m50.0s), 20/20 VUs, 748 complete and 0 interrupted iterations
default   [  64% ] 20/20 VUs  3m50.0s/6m00.0s

running (3m51.0s), 20/20 VUs, 754 complete and 0 interrupted iterations
default   [  64% ] 20/20 VUs  3m51.0s/6m00.0s

running (3m52.0s), 20/20 VUs, 759 complete and 0 interrupted iterations
default   [  64% ] 20/20 VUs  3m52.0s/6m00.0s

running (3m53.0s), 20/20 VUs, 765 complete and 0 interrupted iterations
default   [  65% ] 20/20 VUs  3m53.0s/6m00.0s

running (3m54.0s), 20/20 VUs, 767 complete and 0 interrupted iterations
default   [  65% ] 20/20 VUs  3m54.0s/6m00.0s

running (3m55.0s), 20/20 VUs, 779 complete and 0 interrupted iterations
default   [  65% ] 20/20 VUs  3m55.0s/6m00.0s

running (3m56.0s), 20/20 VUs, 780 complete and 0 interrupted iterations
default   [  66% ] 20/20 VUs  3m56.0s/6m00.0s

running (3m57.0s), 20/20 VUs, 786 complete and 0 interrupted iterations
default   [  66% ] 20/20 VUs  3m57.0s/6m00.0s

running (3m58.0s), 20/20 VUs, 792 complete and 0 interrupted iterations
default   [  66% ] 20/20 VUs  3m58.0s/6m00.0s

running (3m59.0s), 20/20 VUs, 798 complete and 0 interrupted iterations
default   [  66% ] 20/20 VUs  3m59.0s/6m00.0s

running (4m00.0s), 20/20 VUs, 806 complete and 0 interrupted iterations
default   [  67% ] 20/20 VUs  4m00.0s/6m00.0s

running (4m01.0s), 20/20 VUs, 809 complete and 0 interrupted iterations
default   [  67% ] 20/20 VUs  4m01.0s/6m00.0s

running (4m02.0s), 20/20 VUs, 815 complete and 0 interrupted iterations
default   [  67% ] 20/20 VUs  4m02.0s/6m00.0s

running (4m03.0s), 20/20 VUs, 820 complete and 0 interrupted iterations
default   [  67% ] 20/20 VUs  4m03.0s/6m00.0s

running (4m04.0s), 20/20 VUs, 827 complete and 0 interrupted iterations
default   [  68% ] 20/20 VUs  4m04.0s/6m00.0s

running (4m05.0s), 20/20 VUs, 832 complete and 0 interrupted iterations
default   [  68% ] 20/20 VUs  4m05.0s/6m00.0s

running (4m06.0s), 20/20 VUs, 840 complete and 0 interrupted iterations
default   [  68% ] 20/20 VUs  4m06.0s/6m00.0s

running (4m07.0s), 20/20 VUs, 847 complete and 0 interrupted iterations
default   [  69% ] 20/20 VUs  4m07.0s/6m00.0s

running (4m08.0s), 20/20 VUs, 851 complete and 0 interrupted iterations
default   [  69% ] 20/20 VUs  4m08.0s/6m00.0s

running (4m09.0s), 20/20 VUs, 856 complete and 0 interrupted iterations
default   [  69% ] 20/20 VUs  4m09.0s/6m00.0s

running (4m10.0s), 20/20 VUs, 863 complete and 0 interrupted iterations
default   [  69% ] 20/20 VUs  4m10.0s/6m00.0s

running (4m11.0s), 20/20 VUs, 867 complete and 0 interrupted iterations
default   [  70% ] 20/20 VUs  4m11.0s/6m00.0s

running (4m12.0s), 20/20 VUs, 873 complete and 0 interrupted iterations
default   [  70% ] 20/20 VUs  4m12.0s/6m00.0s

running (4m13.0s), 20/20 VUs, 880 complete and 0 interrupted iterations
default   [  70% ] 20/20 VUs  4m13.0s/6m00.0s

running (4m14.0s), 20/20 VUs, 887 complete and 0 interrupted iterations
default   [  71% ] 20/20 VUs  4m14.0s/6m00.0s

running (4m15.0s), 20/20 VUs, 895 complete and 0 interrupted iterations
default   [  71% ] 20/20 VUs  4m15.0s/6m00.0s

running (4m16.0s), 20/20 VUs, 896 complete and 0 interrupted iterations
default   [  71% ] 20/20 VUs  4m16.0s/6m00.0s

running (4m17.0s), 20/20 VUs, 903 complete and 0 interrupted iterations
default   [  71% ] 20/20 VUs  4m17.0s/6m00.0s

running (4m18.0s), 20/20 VUs, 911 complete and 0 interrupted iterations
default   [  72% ] 20/20 VUs  4m18.0s/6m00.0s

running (4m19.0s), 20/20 VUs, 915 complete and 0 interrupted iterations
default   [  72% ] 20/20 VUs  4m19.0s/6m00.0s

running (4m20.0s), 20/20 VUs, 918 complete and 0 interrupted iterations
default   [  72% ] 20/20 VUs  4m20.0s/6m00.0s

running (4m21.0s), 20/20 VUs, 923 complete and 0 interrupted iterations
default   [  72% ] 20/20 VUs  4m21.0s/6m00.0s

running (4m22.0s), 20/20 VUs, 930 complete and 0 interrupted iterations
default   [  73% ] 20/20 VUs  4m22.0s/6m00.0s

running (4m23.0s), 20/20 VUs, 934 complete and 0 interrupted iterations
default   [  73% ] 20/20 VUs  4m23.0s/6m00.0s

running (4m24.0s), 20/20 VUs, 941 complete and 0 interrupted iterations
default   [  73% ] 20/20 VUs  4m24.0s/6m00.0s

running (4m25.0s), 20/20 VUs, 949 complete and 0 interrupted iterations
default   [  74% ] 20/20 VUs  4m25.0s/6m00.0s

running (4m26.0s), 20/20 VUs, 953 complete and 0 interrupted iterations
default   [  74% ] 20/20 VUs  4m26.0s/6m00.0s

running (4m27.0s), 20/20 VUs, 958 complete and 0 interrupted iterations
default   [  74% ] 20/20 VUs  4m27.0s/6m00.0s

running (4m28.0s), 20/20 VUs, 967 complete and 0 interrupted iterations
default   [  74% ] 20/20 VUs  4m28.0s/6m00.0s

running (4m29.0s), 20/20 VUs, 973 complete and 0 interrupted iterations
default   [  75% ] 20/20 VUs  4m29.0s/6m00.0s

running (4m30.0s), 20/20 VUs, 976 complete and 0 interrupted iterations
default   [  75% ] 20/20 VUs  4m30.0s/6m00.0s

running (4m31.0s), 20/20 VUs, 984 complete and 0 interrupted iterations
default   [  75% ] 20/20 VUs  4m31.0s/6m00.0s

running (4m32.0s), 20/20 VUs, 989 complete and 0 interrupted iterations
default   [  76% ] 20/20 VUs  4m32.0s/6m00.0s

running (4m33.0s), 20/20 VUs, 994 complete and 0 interrupted iterations
default   [  76% ] 20/20 VUs  4m33.0s/6m00.0s

running (4m34.0s), 20/20 VUs, 1001 complete and 0 interrupted iterations
default   [  76% ] 20/20 VUs  4m34.0s/6m00.0s

running (4m35.0s), 20/20 VUs, 1004 complete and 0 interrupted iterations
default   [  76% ] 20/20 VUs  4m35.0s/6m00.0s

running (4m36.0s), 20/20 VUs, 1015 complete and 0 interrupted iterations
default   [  77% ] 20/20 VUs  4m36.0s/6m00.0s

running (4m37.0s), 20/20 VUs, 1020 complete and 0 interrupted iterations
default   [  77% ] 20/20 VUs  4m37.0s/6m00.0s

running (4m38.0s), 20/20 VUs, 1026 complete and 0 interrupted iterations
default   [  77% ] 20/20 VUs  4m38.0s/6m00.0s

running (4m39.0s), 20/20 VUs, 1030 complete and 0 interrupted iterations
default   [  77% ] 20/20 VUs  4m39.0s/6m00.0s

running (4m40.0s), 20/20 VUs, 1034 complete and 0 interrupted iterations
default   [  78% ] 20/20 VUs  4m40.0s/6m00.0s

running (4m41.0s), 20/20 VUs, 1040 complete and 0 interrupted iterations
default   [  78% ] 20/20 VUs  4m41.0s/6m00.0s

running (4m42.0s), 20/20 VUs, 1048 complete and 0 interrupted iterations
default   [  78% ] 20/20 VUs  4m42.0s/6m00.0s

running (4m43.0s), 20/20 VUs, 1053 complete and 0 interrupted iterations
default   [  79% ] 20/20 VUs  4m43.0s/6m00.0s

running (4m44.0s), 20/20 VUs, 1060 complete and 0 interrupted iterations
default   [  79% ] 20/20 VUs  4m44.0s/6m00.0s

running (4m45.0s), 20/20 VUs, 1066 complete and 0 interrupted iterations
default   [  79% ] 20/20 VUs  4m45.0s/6m00.0s

running (4m46.0s), 20/20 VUs, 1071 complete and 0 interrupted iterations
default   [  79% ] 20/20 VUs  4m46.0s/6m00.0s

running (4m47.0s), 20/20 VUs, 1079 complete and 0 interrupted iterations
default   [  80% ] 20/20 VUs  4m47.0s/6m00.0s

running (4m48.0s), 20/20 VUs, 1081 complete and 0 interrupted iterations
default   [  80% ] 20/20 VUs  4m48.0s/6m00.0s

running (4m49.0s), 20/20 VUs, 1086 complete and 0 interrupted iterations
default   [  80% ] 20/20 VUs  4m49.0s/6m00.0s

running (4m50.0s), 20/20 VUs, 1094 complete and 0 interrupted iterations
default   [  81% ] 20/20 VUs  4m50.0s/6m00.0s

running (4m51.0s), 20/20 VUs, 1097 complete and 0 interrupted iterations
default   [  81% ] 20/20 VUs  4m51.0s/6m00.0s

running (4m52.0s), 20/20 VUs, 1103 complete and 0 interrupted iterations
default   [  81% ] 20/20 VUs  4m52.0s/6m00.0s

running (4m53.0s), 20/20 VUs, 1109 complete and 0 interrupted iterations
default   [  81% ] 20/20 VUs  4m53.0s/6m00.0s

running (4m54.0s), 20/20 VUs, 1116 complete and 0 interrupted iterations
default   [  82% ] 20/20 VUs  4m54.0s/6m00.0s

running (4m55.0s), 20/20 VUs, 1123 complete and 0 interrupted iterations
default   [  82% ] 20/20 VUs  4m55.0s/6m00.0s

running (4m56.0s), 20/20 VUs, 1128 complete and 0 interrupted iterations
default   [  82% ] 20/20 VUs  4m56.0s/6m00.0s

running (4m57.0s), 20/20 VUs, 1133 complete and 0 interrupted iterations
default   [  82% ] 20/20 VUs  4m57.0s/6m00.0s

running (4m58.0s), 20/20 VUs, 1139 complete and 0 interrupted iterations
default   [  83% ] 20/20 VUs  4m58.0s/6m00.0s

running (4m59.0s), 20/20 VUs, 1144 complete and 0 interrupted iterations
default   [  83% ] 20/20 VUs  4m59.0s/6m00.0s

running (5m00.0s), 20/20 VUs, 1150 complete and 0 interrupted iterations
default   [  83% ] 20/20 VUs  5m00.0s/6m00.0s

running (5m01.0s), 20/20 VUs, 1156 complete and 0 interrupted iterations
default   [  84% ] 20/20 VUs  5m01.0s/6m00.0s

running (5m02.0s), 20/20 VUs, 1159 complete and 0 interrupted iterations
default   [  84% ] 20/20 VUs  5m02.0s/6m00.0s

running (5m03.0s), 20/20 VUs, 1166 complete and 0 interrupted iterations
default   [  84% ] 20/20 VUs  5m03.0s/6m00.0s

running (5m04.0s), 20/20 VUs, 1173 complete and 0 interrupted iterations
default   [  84% ] 20/20 VUs  5m04.0s/6m00.0s

running (5m05.0s), 20/20 VUs, 1179 complete and 0 interrupted iterations
default   [  85% ] 20/20 VUs  5m05.0s/6m00.0s

running (5m06.0s), 20/20 VUs, 1183 complete and 0 interrupted iterations
default   [  85% ] 20/20 VUs  5m06.0s/6m00.0s

running (5m07.0s), 20/20 VUs, 1188 complete and 0 interrupted iterations
default   [  85% ] 20/20 VUs  5m07.0s/6m00.0s

running (5m08.0s), 20/20 VUs, 1191 complete and 0 interrupted iterations
default   [  86% ] 20/20 VUs  5m08.0s/6m00.0s

running (5m09.0s), 20/20 VUs, 1200 complete and 0 interrupted iterations
default   [  86% ] 20/20 VUs  5m09.0s/6m00.0s

running (5m10.0s), 20/20 VUs, 1203 complete and 0 interrupted iterations
default   [  86% ] 20/20 VUs  5m10.0s/6m00.0s

running (5m11.0s), 20/20 VUs, 1210 complete and 0 interrupted iterations
default   [  86% ] 20/20 VUs  5m11.0s/6m00.0s

running (5m12.0s), 20/20 VUs, 1219 complete and 0 interrupted iterations
default   [  87% ] 20/20 VUs  5m12.0s/6m00.0s

running (5m13.0s), 20/20 VUs, 1221 complete and 0 interrupted iterations
default   [  87% ] 20/20 VUs  5m13.0s/6m00.0s

running (5m14.0s), 20/20 VUs, 1226 complete and 0 interrupted iterations
default   [  87% ] 20/20 VUs  5m14.0s/6m00.0s

running (5m15.0s), 20/20 VUs, 1230 complete and 0 interrupted iterations
default   [  87% ] 20/20 VUs  5m15.0s/6m00.0s

running (5m16.0s), 20/20 VUs, 1241 complete and 0 interrupted iterations
default   [  88% ] 20/20 VUs  5m16.0s/6m00.0s

running (5m17.0s), 20/20 VUs, 1244 complete and 0 interrupted iterations
default   [  88% ] 20/20 VUs  5m17.0s/6m00.0s

running (5m18.0s), 20/20 VUs, 1249 complete and 0 interrupted iterations
default   [  88% ] 20/20 VUs  5m18.0s/6m00.0s

running (5m19.0s), 20/20 VUs, 1251 complete and 0 interrupted iterations
default   [  89% ] 20/20 VUs  5m19.0s/6m00.0s

running (5m20.0s), 20/20 VUs, 1261 complete and 0 interrupted iterations
default   [  89% ] 20/20 VUs  5m20.0s/6m00.0s

running (5m21.0s), 20/20 VUs, 1264 complete and 0 interrupted iterations
default   [  89% ] 20/20 VUs  5m21.0s/6m00.0s

running (5m22.0s), 20/20 VUs, 1267 complete and 0 interrupted iterations
default   [  89% ] 20/20 VUs  5m22.0s/6m00.0s

running (5m23.0s), 20/20 VUs, 1277 complete and 0 interrupted iterations
default   [  90% ] 20/20 VUs  5m23.0s/6m00.0s

running (5m24.0s), 20/20 VUs, 1283 complete and 0 interrupted iterations
default   [  90% ] 20/20 VUs  5m24.0s/6m00.0s

running (5m25.0s), 20/20 VUs, 1289 complete and 0 interrupted iterations
default   [  90% ] 20/20 VUs  5m25.0s/6m00.0s

running (5m26.0s), 20/20 VUs, 1294 complete and 0 interrupted iterations
default   [  91% ] 20/20 VUs  5m26.0s/6m00.0s

running (5m27.0s), 20/20 VUs, 1299 complete and 0 interrupted iterations
default   [  91% ] 20/20 VUs  5m27.0s/6m00.0s

running (5m28.0s), 20/20 VUs, 1306 complete and 0 interrupted iterations
default   [  91% ] 20/20 VUs  5m28.0s/6m00.0s

running (5m29.0s), 20/20 VUs, 1310 complete and 0 interrupted iterations
default   [  91% ] 20/20 VUs  5m29.0s/6m00.0s

running (5m30.0s), 20/20 VUs, 1315 complete and 0 interrupted iterations
default   [  92% ] 20/20 VUs  5m30.0s/6m00.0s

running (5m31.0s), 20/20 VUs, 1321 complete and 0 interrupted iterations
default   [  92% ] 20/20 VUs  5m31.0s/6m00.0s

running (5m32.0s), 20/20 VUs, 1327 complete and 0 interrupted iterations
default   [  92% ] 20/20 VUs  5m32.0s/6m00.0s

running (5m33.0s), 20/20 VUs, 1332 complete and 0 interrupted iterations
default   [  92% ] 20/20 VUs  5m33.0s/6m00.0s

running (5m34.0s), 19/20 VUs, 1338 complete and 0 interrupted iterations
default   [  93% ] 19/20 VUs  5m34.0s/6m00.0s

running (5m35.0s), 19/20 VUs, 1341 complete and 0 interrupted iterations
default   [  93% ] 19/20 VUs  5m35.0s/6m00.0s

running (5m36.0s), 17/20 VUs, 1350 complete and 0 interrupted iterations
default   [  93% ] 17/20 VUs  5m36.0s/6m00.0s

running (5m37.0s), 17/20 VUs, 1353 complete and 0 interrupted iterations
default   [  94% ] 17/20 VUs  5m37.0s/6m00.0s

running (5m38.0s), 16/20 VUs, 1356 complete and 0 interrupted iterations
default   [  94% ] 16/20 VUs  5m38.0s/6m00.0s

running (5m39.0s), 16/20 VUs, 1364 complete and 0 interrupted iterations
default   [  94% ] 16/20 VUs  5m39.0s/6m00.0s

running (5m40.0s), 15/20 VUs, 1366 complete and 0 interrupted iterations
default   [  94% ] 15/20 VUs  5m40.0s/6m00.0s

running (5m41.0s), 14/20 VUs, 1371 complete and 0 interrupted iterations
default   [  95% ] 14/20 VUs  5m41.0s/6m00.0s

running (5m42.0s), 14/20 VUs, 1377 complete and 0 interrupted iterations
default   [  95% ] 14/20 VUs  5m42.0s/6m00.0s

running (5m43.0s), 14/20 VUs, 1382 complete and 0 interrupted iterations
default   [  95% ] 14/20 VUs  5m43.0s/6m00.0s

running (5m44.0s), 13/20 VUs, 1383 complete and 0 interrupted iterations
default   [  96% ] 13/20 VUs  5m44.0s/6m00.0s

running (5m45.0s), 11/20 VUs, 1390 complete and 0 interrupted iterations
default   [  96% ] 11/20 VUs  5m45.0s/6m00.0s

running (5m46.0s), 11/20 VUs, 1393 complete and 0 interrupted iterations
default   [  96% ] 11/20 VUs  5m46.0s/6m00.0s

running (5m47.0s), 11/20 VUs, 1395 complete and 0 interrupted iterations
default   [  96% ] 11/20 VUs  5m47.0s/6m00.0s

running (5m48.0s), 10/20 VUs, 1399 complete and 0 interrupted iterations
default   [  97% ] 10/20 VUs  5m48.0s/6m00.0s

running (5m49.0s), 09/20 VUs, 1403 complete and 0 interrupted iterations
default   [  97% ] 09/20 VUs  5m49.0s/6m00.0s

running (5m50.0s), 09/20 VUs, 1405 complete and 0 interrupted iterations
default   [  97% ] 09/20 VUs  5m50.0s/6m00.0s

running (5m51.0s), 08/20 VUs, 1407 complete and 0 interrupted iterations
default   [  97% ] 08/20 VUs  5m51.0s/6m00.0s

running (5m52.0s), 07/20 VUs, 1409 complete and 0 interrupted iterations
default   [  98% ] 07/20 VUs  5m52.0s/6m00.0s

running (5m53.0s), 06/20 VUs, 1412 complete and 0 interrupted iterations
default   [  98% ] 06/20 VUs  5m53.0s/6m00.0s

running (5m54.0s), 06/20 VUs, 1414 complete and 0 interrupted iterations
default   [  98% ] 06/20 VUs  5m54.0s/6m00.0s

running (5m55.0s), 05/20 VUs, 1416 complete and 0 interrupted iterations
default   [  99% ] 05/20 VUs  5m55.0s/6m00.0s

running (5m56.0s), 05/20 VUs, 1418 complete and 0 interrupted iterations
default   [  99% ] 05/20 VUs  5m56.0s/6m00.0s

running (5m57.0s), 03/20 VUs, 1420 complete and 0 interrupted iterations
default   [  99% ] 03/20 VUs  5m57.0s/6m00.0s

running (5m58.0s), 03/20 VUs, 1420 complete and 0 interrupted iterations
default   [  99% ] 03/20 VUs  5m58.0s/6m00.0s

running (5m59.0s), 03/20 VUs, 1420 complete and 0 interrupted iterations
default   [ 100% ] 03/20 VUs  5m59.0s/6m00.0s

running (6m00.0s), 01/20 VUs, 1422 complete and 0 interrupted iterations
default   [ 100% ] 01/20 VUs  6m00.0s/6m00.0s
time="2025-12-16T22:17:54Z" level=info msg="\nAuthentication load test completed" source=console
time="2025-12-16T22:17:54Z" level=info msg="Total duration: 360.26s" source=console


  █ THRESHOLDS 

    errors
    ✗ 'rate<0.05' rate=100.00%

    http_req_duration{endpoint:auth_me}
    ✓ 'p(95)<50' p(95)=0s
    ✓ 'p(99)<100' p(99)=0s

    http_req_duration{endpoint:logout}
    ✓ 'p(95)<30' p(95)=0s
    ✓ 'p(99)<75' p(99)=0s

    http_req_duration{endpoint:token_refresh}
    ✓ 'p(95)<100' p(95)=0s
    ✓ 'p(99)<200' p(99)=0s

    http_req_failed{endpoint:auth_me}
    ✓ 'rate<0.01' rate=0.00%

    http_req_failed{endpoint:token_refresh}
    ✓ 'rate<0.02' rate=0.00%


  █ TOTAL RESULTS 

    checks_total.......: 1423    3.949961/s
    checks_succeeded...: 0.00%   0 out of 1423
    checks_failed......: 100.00% 1423 out of 1423

    ✗ health check is 200
      ↳  0% — ✓ 0 / ✗ 1423

    CUSTOM
    auth_flow_duration.............: avg=0.770204 min=0        med=1        max=3      p(90)=1        p(95)=1       
    errors.........................: 100.00% 1423 out of 1423
    total_requests.................: 1423    3.949961/s

    HTTP
    http_req_duration..............: avg=632.19µs min=367.35µs med=591.91µs max=2.81ms p(90)=899.08µs p(95)=981.93µs
      { endpoint:auth_me }.........: avg=0s       min=0s       med=0s       max=0s     p(90)=0s       p(95)=0s      
      { endpoint:logout }..........: avg=0s       min=0s       med=0s       max=0s     p(90)=0s       p(95)=0s      
      { endpoint:token_refresh }...: avg=0s       min=0s       med=0s       max=0s     p(90)=0s       p(95)=0s      
    http_req_failed................: 100.00% 1423 out of 1423
      { endpoint:auth_me }.........: 0.00%   0 out of 0
      { endpoint:token_refresh }...: 0.00%   0 out of 0
    http_reqs......................: 1423    3.949961/s

    EXECUTION
    iteration_duration.............: avg=3.5s     min=2s       med=3.49s    max=4.99s  p(90)=4.69s    p(95)=4.84s   
    iterations.....................: 1423    3.949961/s
    vus............................: 1       min=1            max=20
    vus_max........................: 20      min=20           max=20

    NETWORK
    data_received..................: 1.8 MB  4.9 kB/s
    data_sent......................: 145 kB  403 B/s




running (6m00.3s), 00/20 VUs, 1423 complete and 0 interrupted iterations
default ✓ [ 100% ] 00/20 VUs  6m0s
time="2025-12-16T22:17:54Z" level=error msg="thresholds on metrics 'errors' have been crossed"
