
         /\      Grafana   /‾‾/  
    /\  /  \     |\  __   /  /   
   /  \/    \    | |/ /  /   ‾‾\ 
  /          \   |   (  |  (‾)  |
 / __________ \  |_|\_\  \_____/ 

     execution: local
        script: backend/tests/load/scenarios/submit.js
        output: -

     scenarios: (100.00%) 1 scenario, 10 max VUs, 4m30s max duration (incl. graceful stop):
              * default: Up to 10 looping VUs for 4m0s over 4 stages (gracefulRampDown: 30s, gracefulStop: 30s)

time="2025-12-16T22:17:54Z" level=info msg="Starting clip submission load test" source=console
time="2025-12-16T22:17:54Z" level=info msg="Target URL: http://localhost:8080" source=console
time="2025-12-16T22:17:54Z" level=info msg="ERROR: No AUTH_TOKEN provided!" source=console
time="2025-12-16T22:17:54Z" level=info msg="Set AUTH_TOKEN environment variable to run this test." source=console
time="2025-12-16T22:17:54Z" level=info msg="Example: k6 run -e AUTH_TOKEN=your_token backend/tests/load/scenarios/submit.js" source=console
time="2025-12-16T22:17:54Z" level=info msg="Skipping test iteration - no AUTH_TOKEN provided" source=console

running (0m01.0s), 01/10 VUs, 0 complete and 0 interrupted iterations
default   [   0% ] 01/10 VUs  0m01.0s/4m00.0s

running (0m02.0s), 01/10 VUs, 0 complete and 0 interrupted iterations
default   [   1% ] 01/10 VUs  0m02.0s/4m00.0s

running (0m03.0s), 01/10 VUs, 0 complete and 0 interrupted iterations
default   [   1% ] 01/10 VUs  0m03.0s/4m00.0s

running (0m04.0s), 01/10 VUs, 0 complete and 0 interrupted iterations
default   [   2% ] 01/10 VUs  0m04.0s/4m00.0s

running (0m05.0s), 01/10 VUs, 0 complete and 0 interrupted iterations
default   [   2% ] 01/10 VUs  0m05.0s/4m00.0s
time="2025-12-16T22:17:59Z" level=info msg="Skipping test iteration - no AUTH_TOKEN provided" source=console

running (0m06.0s), 01/10 VUs, 1 complete and 0 interrupted iterations
default   [   2% ] 01/10 VUs  0m06.0s/4m00.0s

running (0m07.0s), 01/10 VUs, 1 complete and 0 interrupted iterations
default   [   3% ] 01/10 VUs  0m07.0s/4m00.0s
time="2025-12-16T22:18:01Z" level=info msg="Skipping test iteration - no AUTH_TOKEN provided" source=console

running (0m08.0s), 02/10 VUs, 1 complete and 0 interrupted iterations
default   [   3% ] 02/10 VUs  0m08.0s/4m00.0s

running (0m09.0s), 02/10 VUs, 1 complete and 0 interrupted iterations
default   [   4% ] 02/10 VUs  0m09.0s/4m00.0s

running (0m10.0s), 02/10 VUs, 1 complete and 0 interrupted iterations
default   [   4% ] 02/10 VUs  0m10.0s/4m00.0s
time="2025-12-16T22:18:04Z" level=info msg="Skipping test iteration - no AUTH_TOKEN provided" source=console

running (0m11.0s), 02/10 VUs, 2 complete and 0 interrupted iterations
default   [   5% ] 02/10 VUs  0m11.0s/4m00.0s

running (0m12.0s), 02/10 VUs, 2 complete and 0 interrupted iterations
default   [   5% ] 02/10 VUs  0m12.0s/4m00.0s
time="2025-12-16T22:18:06Z" level=info msg="Skipping test iteration - no AUTH_TOKEN provided" source=console

running (0m13.0s), 02/10 VUs, 3 complete and 0 interrupted iterations
default   [   5% ] 02/10 VUs  0m13.0s/4m00.0s

running (0m14.0s), 02/10 VUs, 3 complete and 0 interrupted iterations
default   [   6% ] 02/10 VUs  0m14.0s/4m00.0s

running (0m15.0s), 02/10 VUs, 3 complete and 0 interrupted iterations
default   [   6% ] 02/10 VUs  0m15.0s/4m00.0s
time="2025-12-16T22:18:09Z" level=info msg="Skipping test iteration - no AUTH_TOKEN provided" source=console
time="2025-12-16T22:18:09Z" level=info msg="Skipping test iteration - no AUTH_TOKEN provided" source=console

running (0m16.0s), 03/10 VUs, 4 complete and 0 interrupted iterations
default   [   7% ] 03/10 VUs  0m16.0s/4m00.0s

running (0m17.0s), 03/10 VUs, 4 complete and 0 interrupted iterations
default   [   7% ] 03/10 VUs  0m17.0s/4m00.0s
time="2025-12-16T22:18:11Z" level=info msg="Skipping test iteration - no AUTH_TOKEN provided" source=console

running (0m18.0s), 03/10 VUs, 5 complete and 0 interrupted iterations
default   [   7% ] 03/10 VUs  0m18.0s/4m00.0s

running (0m19.0s), 03/10 VUs, 5 complete and 0 interrupted iterations
default   [   8% ] 03/10 VUs  0m19.0s/4m00.0s

running (0m20.0s), 03/10 VUs, 5 complete and 0 interrupted iterations
default   [   8% ] 03/10 VUs  0m20.0s/4m00.0s
time="2025-12-16T22:18:14Z" level=info msg="Skipping test iteration - no AUTH_TOKEN provided" source=console
time="2025-12-16T22:18:14Z" level=info msg="Skipping test iteration - no AUTH_TOKEN provided" source=console

running (0m21.0s), 03/10 VUs, 7 complete and 0 interrupted iterations
default   [   9% ] 03/10 VUs  0m21.0s/4m00.0s

running (0m22.0s), 03/10 VUs, 7 complete and 0 interrupted iterations
default   [   9% ] 03/10 VUs  0m22.0s/4m00.0s
time="2025-12-16T22:18:16Z" level=info msg="Skipping test iteration - no AUTH_TOKEN provided" source=console
time="2025-12-16T22:18:16Z" level=info msg="Skipping test iteration - no AUTH_TOKEN provided" source=console

running (0m23.0s), 04/10 VUs, 8 complete and 0 interrupted iterations
default   [  10% ] 04/10 VUs  0m23.0s/4m00.0s

running (0m24.0s), 04/10 VUs, 8 complete and 0 interrupted iterations
default   [  10% ] 04/10 VUs  0m24.0s/4m00.0s

running (0m25.0s), 04/10 VUs, 8 complete and 0 interrupted iterations
default   [  10% ] 04/10 VUs  0m25.0s/4m00.0s
time="2025-12-16T22:18:19Z" level=info msg="Skipping test iteration - no AUTH_TOKEN provided" source=console
time="2025-12-16T22:18:19Z" level=info msg="Skipping test iteration - no AUTH_TOKEN provided" source=console

running (0m26.0s), 04/10 VUs, 10 complete and 0 interrupted iterations
default   [  11% ] 04/10 VUs  0m26.0s/4m00.0s

running (0m27.0s), 04/10 VUs, 10 complete and 0 interrupted iterations
default   [  11% ] 04/10 VUs  0m27.0s/4m00.0s
time="2025-12-16T22:18:21Z" level=info msg="Skipping test iteration - no AUTH_TOKEN provided" source=console
time="2025-12-16T22:18:21Z" level=info msg="Skipping test iteration - no AUTH_TOKEN provided" source=console

running (0m28.0s), 04/10 VUs, 12 complete and 0 interrupted iterations
default   [  12% ] 04/10 VUs  0m28.0s/4m00.0s

running (0m29.0s), 04/10 VUs, 12 complete and 0 interrupted iterations
default   [  12% ] 04/10 VUs  0m29.0s/4m00.0s

running (0m30.0s), 04/10 VUs, 12 complete and 0 interrupted iterations
default   [  12% ] 04/10 VUs  0m30.0s/4m00.0s
time="2025-12-16T22:18:24Z" level=info msg="Skipping test iteration - no AUTH_TOKEN provided" source=console
time="2025-12-16T22:18:24Z" level=info msg="Skipping test iteration - no AUTH_TOKEN provided" source=console
time="2025-12-16T22:18:24Z" level=info msg="Skipping test iteration - no AUTH_TOKEN provided" source=console

running (0m31.0s), 05/10 VUs, 14 complete and 0 interrupted iterations
default   [  13% ] 05/10 VUs  0m31.0s/4m00.0s

running (0m32.0s), 05/10 VUs, 14 complete and 0 interrupted iterations
default   [  13% ] 05/10 VUs  0m32.0s/4m00.0s
time="2025-12-16T22:18:26Z" level=info msg="Skipping test iteration - no AUTH_TOKEN provided" source=console
time="2025-12-16T22:18:26Z" level=info msg="Skipping test iteration - no AUTH_TOKEN provided" source=console

running (0m33.0s), 05/10 VUs, 16 complete and 0 interrupted iterations
default   [  14% ] 05/10 VUs  0m33.0s/4m00.0s

running (0m34.0s), 05/10 VUs, 16 complete and 0 interrupted iterations
default   [  14% ] 05/10 VUs  0m34.0s/4m00.0s

running (0m35.0s), 05/10 VUs, 16 complete and 0 interrupted iterations
default   [  15% ] 05/10 VUs  0m35.0s/4m00.0s
time="2025-12-16T22:18:29Z" level=info msg="Skipping test iteration - no AUTH_TOKEN provided" source=console
time="2025-12-16T22:18:29Z" level=info msg="Skipping test iteration - no AUTH_TOKEN provided" source=console
time="2025-12-16T22:18:29Z" level=info msg="Skipping test iteration - no AUTH_TOKEN provided" source=console

running (0m36.0s), 05/10 VUs, 19 complete and 0 interrupted iterations
default   [  15% ] 05/10 VUs  0m36.0s/4m00.0s

running (0m37.0s), 05/10 VUs, 19 complete and 0 interrupted iterations
default   [  15% ] 05/10 VUs  0m37.0s/4m00.0s
time="2025-12-16T22:18:31Z" level=info msg="Skipping test iteration - no AUTH_TOKEN provided" source=console
time="2025-12-16T22:18:31Z" level=info msg="Skipping test iteration - no AUTH_TOKEN provided" source=console

running (0m38.0s), 05/10 VUs, 21 complete and 0 interrupted iterations
default   [  16% ] 05/10 VUs  0m38.0s/4m00.0s

running (0m39.0s), 05/10 VUs, 21 complete and 0 interrupted iterations
default   [  16% ] 05/10 VUs  0m39.0s/4m00.0s

running (0m40.0s), 05/10 VUs, 21 complete and 0 interrupted iterations
default   [  17% ] 05/10 VUs  0m40.0s/4m00.0s
time="2025-12-16T22:18:34Z" level=info msg="Skipping test iteration - no AUTH_TOKEN provided" source=console
time="2025-12-16T22:18:34Z" level=info msg="Skipping test iteration - no AUTH_TOKEN provided" source=console
time="2025-12-16T22:18:34Z" level=info msg="Skipping test iteration - no AUTH_TOKEN provided" source=console

running (0m41.0s), 05/10 VUs, 24 complete and 0 interrupted iterations
default   [  17% ] 05/10 VUs  0m41.0s/4m00.0s

running (0m42.0s), 05/10 VUs, 24 complete and 0 interrupted iterations
default   [  17% ] 05/10 VUs  0m42.0s/4m00.0s
time="2025-12-16T22:18:36Z" level=info msg="Skipping test iteration - no AUTH_TOKEN provided" source=console
time="2025-12-16T22:18:36Z" level=info msg="Skipping test iteration - no AUTH_TOKEN provided" source=console
time="2025-12-16T22:18:36Z" level=info msg="Skipping test iteration - no AUTH_TOKEN provided" source=console

running (0m43.0s), 06/10 VUs, 26 complete and 0 interrupted iterations
default   [  18% ] 06/10 VUs  0m43.0s/4m00.0s

running (0m44.0s), 06/10 VUs, 26 complete and 0 interrupted iterations
default   [  18% ] 06/10 VUs  0m44.0s/4m00.0s

running (0m45.0s), 06/10 VUs, 26 complete and 0 interrupted iterations
default   [  19% ] 06/10 VUs  0m45.0s/4m00.0s
time="2025-12-16T22:18:39Z" level=info msg="Skipping test iteration - no AUTH_TOKEN provided" source=console
time="2025-12-16T22:18:39Z" level=info msg="Skipping test iteration - no AUTH_TOKEN provided" source=console
time="2025-12-16T22:18:39Z" level=info msg="Skipping test iteration - no AUTH_TOKEN provided" source=console

running (0m46.0s), 06/10 VUs, 29 complete and 0 interrupted iterations
default   [  19% ] 06/10 VUs  0m46.0s/4m00.0s

running (0m47.0s), 06/10 VUs, 29 complete and 0 interrupted iterations
default   [  20% ] 06/10 VUs  0m47.0s/4m00.0s
time="2025-12-16T22:18:41Z" level=info msg="Skipping test iteration - no AUTH_TOKEN provided" source=console
time="2025-12-16T22:18:41Z" level=info msg="Skipping test iteration - no AUTH_TOKEN provided" source=console
time="2025-12-16T22:18:41Z" level=info msg="Skipping test iteration - no AUTH_TOKEN provided" source=console

running (0m48.0s), 06/10 VUs, 32 complete and 0 interrupted iterations
default   [  20% ] 06/10 VUs  0m48.0s/4m00.0s

running (0m49.0s), 06/10 VUs, 32 complete and 0 interrupted iterations
default   [  20% ] 06/10 VUs  0m49.0s/4m00.0s

running (0m50.0s), 06/10 VUs, 32 complete and 0 interrupted iterations
default   [  21% ] 06/10 VUs  0m50.0s/4m00.0s
time="2025-12-16T22:18:44Z" level=info msg="Skipping test iteration - no AUTH_TOKEN provided" source=console
time="2025-12-16T22:18:44Z" level=info msg="Skipping test iteration - no AUTH_TOKEN provided" source=console
time="2025-12-16T22:18:44Z" level=info msg="Skipping test iteration - no AUTH_TOKEN provided" source=console

running (0m51.0s), 06/10 VUs, 35 complete and 0 interrupted iterations
default   [  21% ] 06/10 VUs  0m51.0s/4m00.0s

running (0m52.0s), 06/10 VUs, 35 complete and 0 interrupted iterations
default   [  22% ] 06/10 VUs  0m52.0s/4m00.0s
time="2025-12-16T22:18:46Z" level=info msg="Skipping test iteration - no AUTH_TOKEN provided" source=console
time="2025-12-16T22:18:46Z" level=info msg="Skipping test iteration - no AUTH_TOKEN provided" source=console
time="2025-12-16T22:18:46Z" level=info msg="Skipping test iteration - no AUTH_TOKEN provided" source=console

running (0m53.0s), 06/10 VUs, 38 complete and 0 interrupted iterations
default   [  22% ] 06/10 VUs  0m53.0s/4m00.0s

running (0m54.0s), 06/10 VUs, 38 complete and 0 interrupted iterations
default   [  22% ] 06/10 VUs  0m54.0s/4m00.0s
time="2025-12-16T22:18:48Z" level=info msg="Skipping test iteration - no AUTH_TOKEN provided" source=console

running (0m55.0s), 07/10 VUs, 38 complete and 0 interrupted iterations
default   [  23% ] 07/10 VUs  0m55.0s/4m00.0s
time="2025-12-16T22:18:49Z" level=info msg="Skipping test iteration - no AUTH_TOKEN provided" source=console
time="2025-12-16T22:18:49Z" level=info msg="Skipping test iteration - no AUTH_TOKEN provided" source=console
time="2025-12-16T22:18:49Z" level=info msg="Skipping test iteration - no AUTH_TOKEN provided" source=console

running (0m56.0s), 07/10 VUs, 41 complete and 0 interrupted iterations
default   [  23% ] 07/10 VUs  0m56.0s/4m00.0s

running (0m57.0s), 07/10 VUs, 41 complete and 0 interrupted iterations
default   [  24% ] 07/10 VUs  0m57.0s/4m00.0s
time="2025-12-16T22:18:51Z" level=info msg="Skipping test iteration - no AUTH_TOKEN provided" source=console
time="2025-12-16T22:18:51Z" level=info msg="Skipping test iteration - no AUTH_TOKEN provided" source=console
time="2025-12-16T22:18:51Z" level=info msg="Skipping test iteration - no AUTH_TOKEN provided" source=console

running (0m58.0s), 07/10 VUs, 44 complete and 0 interrupted iterations
default   [  24% ] 07/10 VUs  0m58.0s/4m00.0s

running (0m59.0s), 07/10 VUs, 44 complete and 0 interrupted iterations
default   [  25% ] 07/10 VUs  0m59.0s/4m00.0s
time="2025-12-16T22:18:53Z" level=info msg="Skipping test iteration - no AUTH_TOKEN provided" source=console

running (1m00.0s), 07/10 VUs, 45 complete and 0 interrupted iterations
default   [  25% ] 07/10 VUs  1m00.0s/4m00.0s
time="2025-12-16T22:18:54Z" level=info msg="Skipping test iteration - no AUTH_TOKEN provided" source=console
time="2025-12-16T22:18:54Z" level=info msg="Skipping test iteration - no AUTH_TOKEN provided" source=console
time="2025-12-16T22:18:54Z" level=info msg="Skipping test iteration - no AUTH_TOKEN provided" source=console

running (1m01.0s), 07/10 VUs, 48 complete and 0 interrupted iterations
default   [  25% ] 07/10 VUs  1m01.0s/4m00.0s

running (1m02.0s), 07/10 VUs, 48 complete and 0 interrupted iterations
default   [  26% ] 07/10 VUs  1m02.0s/4m00.0s
time="2025-12-16T22:18:56Z" level=info msg="Skipping test iteration - no AUTH_TOKEN provided" source=console
time="2025-12-16T22:18:56Z" level=info msg="Skipping test iteration - no AUTH_TOKEN provided" source=console
time="2025-12-16T22:18:56Z" level=info msg="Skipping test iteration - no AUTH_TOKEN provided" source=console

running (1m03.0s), 07/10 VUs, 51 complete and 0 interrupted iterations
default   [  26% ] 07/10 VUs  1m03.0s/4m00.0s

running (1m04.0s), 07/10 VUs, 51 complete and 0 interrupted iterations
default   [  27% ] 07/10 VUs  1m04.0s/4m00.0s
time="2025-12-16T22:18:58Z" level=info msg="Skipping test iteration - no AUTH_TOKEN provided" source=console

running (1m05.0s), 07/10 VUs, 52 complete and 0 interrupted iterations
default   [  27% ] 07/10 VUs  1m05.0s/4m00.0s
time="2025-12-16T22:18:59Z" level=info msg="Skipping test iteration - no AUTH_TOKEN provided" source=console
time="2025-12-16T22:18:59Z" level=info msg="Skipping test iteration - no AUTH_TOKEN provided" source=console
time="2025-12-16T22:18:59Z" level=info msg="Skipping test iteration - no AUTH_TOKEN provided" source=console

running (1m06.0s), 07/10 VUs, 55 complete and 0 interrupted iterations
default   [  27% ] 07/10 VUs  1m06.0s/4m00.0s
time="2025-12-16T22:19:00Z" level=info msg="Skipping test iteration - no AUTH_TOKEN provided" source=console

running (1m07.0s), 08/10 VUs, 55 complete and 0 interrupted iterations
default   [  28% ] 08/10 VUs  1m07.0s/4m00.0s
time="2025-12-16T22:19:01Z" level=info msg="Skipping test iteration - no AUTH_TOKEN provided" source=console
time="2025-12-16T22:19:01Z" level=info msg="Skipping test iteration - no AUTH_TOKEN provided" source=console
time="2025-12-16T22:19:01Z" level=info msg="Skipping test iteration - no AUTH_TOKEN provided" source=console

running (1m08.0s), 08/10 VUs, 58 complete and 0 interrupted iterations
default   [  28% ] 08/10 VUs  1m08.0s/4m00.0s

running (1m09.0s), 08/10 VUs, 58 complete and 0 interrupted iterations
default   [  29% ] 08/10 VUs  1m09.0s/4m00.0s
time="2025-12-16T22:19:03Z" level=info msg="Skipping test iteration - no AUTH_TOKEN provided" source=console

running (1m10.0s), 08/10 VUs, 59 complete and 0 interrupted iterations
default   [  29% ] 08/10 VUs  1m10.0s/4m00.0s
time="2025-12-16T22:19:04Z" level=info msg="Skipping test iteration - no AUTH_TOKEN provided" source=console
time="2025-12-16T22:19:04Z" level=info msg="Skipping test iteration - no AUTH_TOKEN provided" source=console
time="2025-12-16T22:19:04Z" level=info msg="Skipping test iteration - no AUTH_TOKEN provided" source=console

running (1m11.0s), 08/10 VUs, 62 complete and 0 interrupted iterations
default   [  30% ] 08/10 VUs  1m11.0s/4m00.0s
time="2025-12-16T22:19:05Z" level=info msg="Skipping test iteration - no AUTH_TOKEN provided" source=console

running (1m12.0s), 08/10 VUs, 63 complete and 0 interrupted iterations
default   [  30% ] 08/10 VUs  1m12.0s/4m00.0s
time="2025-12-16T22:19:06Z" level=info msg="Skipping test iteration - no AUTH_TOKEN provided" source=console
time="2025-12-16T22:19:06Z" level=info msg="Skipping test iteration - no AUTH_TOKEN provided" source=console
time="2025-12-16T22:19:06Z" level=info msg="Skipping test iteration - no AUTH_TOKEN provided" source=console

running (1m13.0s), 08/10 VUs, 66 complete and 0 interrupted iterations
default   [  30% ] 08/10 VUs  1m13.0s/4m00.0s

running (1m14.0s), 08/10 VUs, 66 complete and 0 interrupted iterations
default   [  31% ] 08/10 VUs  1m14.0s/4m00.0s
time="2025-12-16T22:19:08Z" level=info msg="Skipping test iteration - no AUTH_TOKEN provided" source=console

running (1m15.0s), 08/10 VUs, 67 complete and 0 interrupted iterations
default   [  31% ] 08/10 VUs  1m15.0s/4m00.0s
time="2025-12-16T22:19:09Z" level=info msg="Skipping test iteration - no AUTH_TOKEN provided" source=console
time="2025-12-16T22:19:09Z" level=info msg="Skipping test iteration - no AUTH_TOKEN provided" source=console
time="2025-12-16T22:19:09Z" level=info msg="Skipping test iteration - no AUTH_TOKEN provided" source=console

running (1m16.0s), 08/10 VUs, 70 complete and 0 interrupted iterations
default   [  32% ] 08/10 VUs  1m16.0s/4m00.0s
time="2025-12-16T22:19:10Z" level=info msg="Skipping test iteration - no AUTH_TOKEN provided" source=console

running (1m17.0s), 08/10 VUs, 71 complete and 0 interrupted iterations
default   [  32% ] 08/10 VUs  1m17.0s/4m00.0s
time="2025-12-16T22:19:11Z" level=info msg="Skipping test iteration - no AUTH_TOKEN provided" source=console
time="2025-12-16T22:19:11Z" level=info msg="Skipping test iteration - no AUTH_TOKEN provided" source=console
time="2025-12-16T22:19:11Z" level=info msg="Skipping test iteration - no AUTH_TOKEN provided" source=console

running (1m18.0s), 08/10 VUs, 74 complete and 0 interrupted iterations
default   [  32% ] 08/10 VUs  1m18.0s/4m00.0s
time="2025-12-16T22:19:12Z" level=info msg="Skipping test iteration - no AUTH_TOKEN provided" source=console

running (1m19.0s), 09/10 VUs, 74 complete and 0 interrupted iterations
default   [  33% ] 09/10 VUs  1m19.0s/4m00.0s
time="2025-12-16T22:19:13Z" level=info msg="Skipping test iteration - no AUTH_TOKEN provided" source=console

running (1m20.0s), 09/10 VUs, 75 complete and 0 interrupted iterations
default   [  33% ] 09/10 VUs  1m20.0s/4m00.0s
time="2025-12-16T22:19:14Z" level=info msg="Skipping test iteration - no AUTH_TOKEN provided" source=console
time="2025-12-16T22:19:14Z" level=info msg="Skipping test iteration - no AUTH_TOKEN provided" source=console
time="2025-12-16T22:19:14Z" level=info msg="Skipping test iteration - no AUTH_TOKEN provided" source=console

running (1m21.0s), 09/10 VUs, 78 complete and 0 interrupted iterations
default   [  34% ] 09/10 VUs  1m21.0s/4m00.0s
time="2025-12-16T22:19:15Z" level=info msg="Skipping test iteration - no AUTH_TOKEN provided" source=console

running (1m22.0s), 09/10 VUs, 79 complete and 0 interrupted iterations
default   [  34% ] 09/10 VUs  1m22.0s/4m00.0s
time="2025-12-16T22:19:16Z" level=info msg="Skipping test iteration - no AUTH_TOKEN provided" source=console
time="2025-12-16T22:19:16Z" level=info msg="Skipping test iteration - no AUTH_TOKEN provided" source=console
time="2025-12-16T22:19:16Z" level=info msg="Skipping test iteration - no AUTH_TOKEN provided" source=console

running (1m23.0s), 09/10 VUs, 82 complete and 0 interrupted iterations
default   [  35% ] 09/10 VUs  1m23.0s/4m00.0s
time="2025-12-16T22:19:17Z" level=info msg="Skipping test iteration - no AUTH_TOKEN provided" source=console

running (1m24.0s), 09/10 VUs, 83 complete and 0 interrupted iterations
default   [  35% ] 09/10 VUs  1m24.0s/4m00.0s
time="2025-12-16T22:19:18Z" level=info msg="Skipping test iteration - no AUTH_TOKEN provided" source=console

running (1m25.0s), 09/10 VUs, 84 complete and 0 interrupted iterations
default   [  35% ] 09/10 VUs  1m25.0s/4m00.0s
time="2025-12-16T22:19:19Z" level=info msg="Skipping test iteration - no AUTH_TOKEN provided" source=console
time="2025-12-16T22:19:19Z" level=info msg="Skipping test iteration - no AUTH_TOKEN provided" source=console
time="2025-12-16T22:19:19Z" level=info msg="Skipping test iteration - no AUTH_TOKEN provided" source=console

running (1m26.0s), 09/10 VUs, 87 complete and 0 interrupted iterations
default   [  36% ] 09/10 VUs  1m26.0s/4m00.0s
time="2025-12-16T22:19:20Z" level=info msg="Skipping test iteration - no AUTH_TOKEN provided" source=console

running (1m27.0s), 09/10 VUs, 88 complete and 0 interrupted iterations
default   [  36% ] 09/10 VUs  1m27.0s/4m00.0s
time="2025-12-16T22:19:21Z" level=info msg="Skipping test iteration - no AUTH_TOKEN provided" source=console
time="2025-12-16T22:19:21Z" level=info msg="Skipping test iteration - no AUTH_TOKEN provided" source=console
time="2025-12-16T22:19:21Z" level=info msg="Skipping test iteration - no AUTH_TOKEN provided" source=console

running (1m28.0s), 09/10 VUs, 91 complete and 0 interrupted iterations
default   [  37% ] 09/10 VUs  1m28.0s/4m00.0s
time="2025-12-16T22:19:22Z" level=info msg="Skipping test iteration - no AUTH_TOKEN provided" source=console

running (1m29.0s), 09/10 VUs, 92 complete and 0 interrupted iterations
default   [  37% ] 09/10 VUs  1m29.0s/4m00.0s
time="2025-12-16T22:19:23Z" level=info msg="Skipping test iteration - no AUTH_TOKEN provided" source=console

running (1m30.0s), 09/10 VUs, 93 complete and 0 interrupted iterations
default   [  37% ] 09/10 VUs  1m30.0s/4m00.0s
time="2025-12-16T22:19:24Z" level=info msg="Skipping test iteration - no AUTH_TOKEN provided" source=console
time="2025-12-16T22:19:24Z" level=info msg="Skipping test iteration - no AUTH_TOKEN provided" source=console
time="2025-12-16T22:19:24Z" level=info msg="Skipping test iteration - no AUTH_TOKEN provided" source=console
time="2025-12-16T22:19:24Z" level=info msg="Skipping test iteration - no AUTH_TOKEN provided" source=console

running (1m31.0s), 10/10 VUs, 96 complete and 0 interrupted iterations
default   [  38% ] 10/10 VUs  1m31.0s/4m00.0s
time="2025-12-16T22:19:25Z" level=info msg="Skipping test iteration - no AUTH_TOKEN provided" source=console

running (1m32.0s), 10/10 VUs, 97 complete and 0 interrupted iterations
default   [  38% ] 10/10 VUs  1m32.0s/4m00.0s
time="2025-12-16T22:19:26Z" level=info msg="Skipping test iteration - no AUTH_TOKEN provided" source=console
time="2025-12-16T22:19:26Z" level=info msg="Skipping test iteration - no AUTH_TOKEN provided" source=console
time="2025-12-16T22:19:26Z" level=info msg="Skipping test iteration - no AUTH_TOKEN provided" source=console

running (1m33.0s), 10/10 VUs, 100 complete and 0 interrupted iterations
default   [  39% ] 10/10 VUs  1m33.0s/4m00.0s
time="2025-12-16T22:19:27Z" level=info msg="Skipping test iteration - no AUTH_TOKEN provided" source=console

running (1m34.0s), 10/10 VUs, 101 complete and 0 interrupted iterations
default   [  39% ] 10/10 VUs  1m34.0s/4m00.0s
time="2025-12-16T22:19:28Z" level=info msg="Skipping test iteration - no AUTH_TOKEN provided" source=console

running (1m35.0s), 10/10 VUs, 102 complete and 0 interrupted iterations
default   [  40% ] 10/10 VUs  1m35.0s/4m00.0s
time="2025-12-16T22:19:29Z" level=info msg="Skipping test iteration - no AUTH_TOKEN provided" source=console
time="2025-12-16T22:19:29Z" level=info msg="Skipping test iteration - no AUTH_TOKEN provided" source=console
time="2025-12-16T22:19:29Z" level=info msg="Skipping test iteration - no AUTH_TOKEN provided" source=console
time="2025-12-16T22:19:29Z" level=info msg="Skipping test iteration - no AUTH_TOKEN provided" source=console

running (1m36.0s), 10/10 VUs, 106 complete and 0 interrupted iterations
default   [  40% ] 10/10 VUs  1m36.0s/4m00.0s
time="2025-12-16T22:19:30Z" level=info msg="Skipping test iteration - no AUTH_TOKEN provided" source=console

running (1m37.0s), 10/10 VUs, 107 complete and 0 interrupted iterations
default   [  40% ] 10/10 VUs  1m37.0s/4m00.0s
time="2025-12-16T22:19:31Z" level=info msg="Skipping test iteration - no AUTH_TOKEN provided" source=console
time="2025-12-16T22:19:31Z" level=info msg="Skipping test iteration - no AUTH_TOKEN provided" source=console
time="2025-12-16T22:19:31Z" level=info msg="Skipping test iteration - no AUTH_TOKEN provided" source=console

running (1m38.0s), 10/10 VUs, 110 complete and 0 interrupted iterations
default   [  41% ] 10/10 VUs  1m38.0s/4m00.0s
time="2025-12-16T22:19:32Z" level=info msg="Skipping test iteration - no AUTH_TOKEN provided" source=console

running (1m39.0s), 10/10 VUs, 111 complete and 0 interrupted iterations
default   [  41% ] 10/10 VUs  1m39.0s/4m00.0s
time="2025-12-16T22:19:33Z" level=info msg="Skipping test iteration - no AUTH_TOKEN provided" source=console

running (1m40.0s), 10/10 VUs, 112 complete and 0 interrupted iterations
default   [  42% ] 10/10 VUs  1m40.0s/4m00.0s
time="2025-12-16T22:19:34Z" level=info msg="Skipping test iteration - no AUTH_TOKEN provided" source=console
time="2025-12-16T22:19:34Z" level=info msg="Skipping test iteration - no AUTH_TOKEN provided" source=console
time="2025-12-16T22:19:34Z" level=info msg="Skipping test iteration - no AUTH_TOKEN provided" source=console
time="2025-12-16T22:19:34Z" level=info msg="Skipping test iteration - no AUTH_TOKEN provided" source=console

running (1m41.0s), 10/10 VUs, 116 complete and 0 interrupted iterations
default   [  42% ] 10/10 VUs  1m41.0s/4m00.0s
time="2025-12-16T22:19:35Z" level=info msg="Skipping test iteration - no AUTH_TOKEN provided" source=console

running (1m42.0s), 10/10 VUs, 117 complete and 0 interrupted iterations
default   [  42% ] 10/10 VUs  1m42.0s/4m00.0s
time="2025-12-16T22:19:36Z" level=info msg="Skipping test iteration - no AUTH_TOKEN provided" source=console
time="2025-12-16T22:19:36Z" level=info msg="Skipping test iteration - no AUTH_TOKEN provided" source=console
time="2025-12-16T22:19:36Z" level=info msg="Skipping test iteration - no AUTH_TOKEN provided" source=console

running (1m43.0s), 10/10 VUs, 120 complete and 0 interrupted iterations
default   [  43% ] 10/10 VUs  1m43.0s/4m00.0s
time="2025-12-16T22:19:37Z" level=info msg="Skipping test iteration - no AUTH_TOKEN provided" source=console

running (1m44.0s), 10/10 VUs, 121 complete and 0 interrupted iterations
default   [  43% ] 10/10 VUs  1m44.0s/4m00.0s
time="2025-12-16T22:19:38Z" level=info msg="Skipping test iteration - no AUTH_TOKEN provided" source=console

running (1m45.0s), 10/10 VUs, 122 complete and 0 interrupted iterations
default   [  44% ] 10/10 VUs  1m45.0s/4m00.0s
time="2025-12-16T22:19:39Z" level=info msg="Skipping test iteration - no AUTH_TOKEN provided" source=console
time="2025-12-16T22:19:39Z" level=info msg="Skipping test iteration - no AUTH_TOKEN provided" source=console
time="2025-12-16T22:19:39Z" level=info msg="Skipping test iteration - no AUTH_TOKEN provided" source=console
time="2025-12-16T22:19:39Z" level=info msg="Skipping test iteration - no AUTH_TOKEN provided" source=console

running (1m46.0s), 10/10 VUs, 126 complete and 0 interrupted iterations
default   [  44% ] 10/10 VUs  1m46.0s/4m00.0s
time="2025-12-16T22:19:40Z" level=info msg="Skipping test iteration - no AUTH_TOKEN provided" source=console

running (1m47.0s), 10/10 VUs, 127 complete and 0 interrupted iterations
default   [  45% ] 10/10 VUs  1m47.0s/4m00.0s
time="2025-12-16T22:19:41Z" level=info msg="Skipping test iteration - no AUTH_TOKEN provided" source=console
time="2025-12-16T22:19:41Z" level=info msg="Skipping test iteration - no AUTH_TOKEN provided" source=console
time="2025-12-16T22:19:41Z" level=info msg="Skipping test iteration - no AUTH_TOKEN provided" source=console

running (1m48.0s), 10/10 VUs, 130 complete and 0 interrupted iterations
default   [  45% ] 10/10 VUs  1m48.0s/4m00.0s
time="2025-12-16T22:19:42Z" level=info msg="Skipping test iteration - no AUTH_TOKEN provided" source=console

running (1m49.0s), 10/10 VUs, 131 complete and 0 interrupted iterations
default   [  45% ] 10/10 VUs  1m49.0s/4m00.0s
time="2025-12-16T22:19:43Z" level=info msg="Skipping test iteration - no AUTH_TOKEN provided" source=console

running (1m50.0s), 10/10 VUs, 132 complete and 0 interrupted iterations
default   [  46% ] 10/10 VUs  1m50.0s/4m00.0s
time="2025-12-16T22:19:44Z" level=info msg="Skipping test iteration - no AUTH_TOKEN provided" source=console
time="2025-12-16T22:19:44Z" level=info msg="Skipping test iteration - no AUTH_TOKEN provided" source=console
time="2025-12-16T22:19:44Z" level=info msg="Skipping test iteration - no AUTH_TOKEN provided" source=console
time="2025-12-16T22:19:44Z" level=info msg="Skipping test iteration - no AUTH_TOKEN provided" source=console

running (1m51.0s), 10/10 VUs, 136 complete and 0 interrupted iterations
default   [  46% ] 10/10 VUs  1m51.0s/4m00.0s
time="2025-12-16T22:19:45Z" level=info msg="Skipping test iteration - no AUTH_TOKEN provided" source=console

running (1m52.0s), 10/10 VUs, 137 complete and 0 interrupted iterations
default   [  47% ] 10/10 VUs  1m52.0s/4m00.0s
time="2025-12-16T22:19:46Z" level=info msg="Skipping test iteration - no AUTH_TOKEN provided" source=console
time="2025-12-16T22:19:46Z" level=info msg="Skipping test iteration - no AUTH_TOKEN provided" source=console
time="2025-12-16T22:19:46Z" level=info msg="Skipping test iteration - no AUTH_TOKEN provided" source=console

running (1m53.0s), 10/10 VUs, 140 complete and 0 interrupted iterations
default   [  47% ] 10/10 VUs  1m53.0s/4m00.0s
time="2025-12-16T22:19:47Z" level=info msg="Skipping test iteration - no AUTH_TOKEN provided" source=console

running (1m54.0s), 10/10 VUs, 141 complete and 0 interrupted iterations
default   [  47% ] 10/10 VUs  1m54.0s/4m00.0s
time="2025-12-16T22:19:48Z" level=info msg="Skipping test iteration - no AUTH_TOKEN provided" source=console

running (1m55.0s), 10/10 VUs, 142 complete and 0 interrupted iterations
default   [  48% ] 10/10 VUs  1m55.0s/4m00.0s
time="2025-12-16T22:19:49Z" level=info msg="Skipping test iteration - no AUTH_TOKEN provided" source=console
time="2025-12-16T22:19:49Z" level=info msg="Skipping test iteration - no AUTH_TOKEN provided" source=console
time="2025-12-16T22:19:49Z" level=info msg="Skipping test iteration - no AUTH_TOKEN provided" source=console
time="2025-12-16T22:19:49Z" level=info msg="Skipping test iteration - no AUTH_TOKEN provided" source=console

running (1m56.0s), 10/10 VUs, 146 complete and 0 interrupted iterations
default   [  48% ] 10/10 VUs  1m56.0s/4m00.0s
time="2025-12-16T22:19:50Z" level=info msg="Skipping test iteration - no AUTH_TOKEN provided" source=console

running (1m57.0s), 10/10 VUs, 147 complete and 0 interrupted iterations
default   [  49% ] 10/10 VUs  1m57.0s/4m00.0s
time="2025-12-16T22:19:51Z" level=info msg="Skipping test iteration - no AUTH_TOKEN provided" source=console
time="2025-12-16T22:19:51Z" level=info msg="Skipping test iteration - no AUTH_TOKEN provided" source=console
time="2025-12-16T22:19:51Z" level=info msg="Skipping test iteration - no AUTH_TOKEN provided" source=console

running (1m58.0s), 10/10 VUs, 150 complete and 0 interrupted iterations
default   [  49% ] 10/10 VUs  1m58.0s/4m00.0s
time="2025-12-16T22:19:52Z" level=info msg="Skipping test iteration - no AUTH_TOKEN provided" source=console

running (1m59.0s), 10/10 VUs, 151 complete and 0 interrupted iterations
default   [  50% ] 10/10 VUs  1m59.0s/4m00.0s
time="2025-12-16T22:19:53Z" level=info msg="Skipping test iteration - no AUTH_TOKEN provided" source=console

running (2m00.0s), 10/10 VUs, 152 complete and 0 interrupted iterations
default   [  50% ] 10/10 VUs  2m00.0s/4m00.0s
time="2025-12-16T22:19:54Z" level=info msg="Skipping test iteration - no AUTH_TOKEN provided" source=console
time="2025-12-16T22:19:54Z" level=info msg="Skipping test iteration - no AUTH_TOKEN provided" source=console
time="2025-12-16T22:19:54Z" level=info msg="Skipping test iteration - no AUTH_TOKEN provided" source=console
time="2025-12-16T22:19:54Z" level=info msg="Skipping test iteration - no AUTH_TOKEN provided" source=console

running (2m01.0s), 10/10 VUs, 156 complete and 0 interrupted iterations
default   [  50% ] 10/10 VUs  2m01.0s/4m00.0s
time="2025-12-16T22:19:55Z" level=info msg="Skipping test iteration - no AUTH_TOKEN provided" source=console

running (2m02.0s), 10/10 VUs, 157 complete and 0 interrupted iterations
default   [  51% ] 10/10 VUs  2m02.0s/4m00.0s
time="2025-12-16T22:19:56Z" level=info msg="Skipping test iteration - no AUTH_TOKEN provided" source=console
time="2025-12-16T22:19:56Z" level=info msg="Skipping test iteration - no AUTH_TOKEN provided" source=console
time="2025-12-16T22:19:56Z" level=info msg="Skipping test iteration - no AUTH_TOKEN provided" source=console

running (2m03.0s), 10/10 VUs, 160 complete and 0 interrupted iterations
default   [  51% ] 10/10 VUs  2m03.0s/4m00.0s
time="2025-12-16T22:19:57Z" level=info msg="Skipping test iteration - no AUTH_TOKEN provided" source=console

running (2m04.0s), 10/10 VUs, 161 complete and 0 interrupted iterations
default   [  52% ] 10/10 VUs  2m04.0s/4m00.0s
time="2025-12-16T22:19:58Z" level=info msg="Skipping test iteration - no AUTH_TOKEN provided" source=console

running (2m05.0s), 10/10 VUs, 162 complete and 0 interrupted iterations
default   [  52% ] 10/10 VUs  2m05.0s/4m00.0s
time="2025-12-16T22:19:59Z" level=info msg="Skipping test iteration - no AUTH_TOKEN provided" source=console
time="2025-12-16T22:19:59Z" level=info msg="Skipping test iteration - no AUTH_TOKEN provided" source=console
time="2025-12-16T22:19:59Z" level=info msg="Skipping test iteration - no AUTH_TOKEN provided" source=console
time="2025-12-16T22:19:59Z" level=info msg="Skipping test iteration - no AUTH_TOKEN provided" source=console

running (2m06.0s), 10/10 VUs, 166 complete and 0 interrupted iterations
default   [  52% ] 10/10 VUs  2m06.0s/4m00.0s
time="2025-12-16T22:20:00Z" level=info msg="Skipping test iteration - no AUTH_TOKEN provided" source=console

running (2m07.0s), 10/10 VUs, 167 complete and 0 interrupted iterations
default   [  53% ] 10/10 VUs  2m07.0s/4m00.0s
time="2025-12-16T22:20:01Z" level=info msg="Skipping test iteration - no AUTH_TOKEN provided" source=console
time="2025-12-16T22:20:01Z" level=info msg="Skipping test iteration - no AUTH_TOKEN provided" source=console
time="2025-12-16T22:20:01Z" level=info msg="Skipping test iteration - no AUTH_TOKEN provided" source=console

running (2m08.0s), 10/10 VUs, 170 complete and 0 interrupted iterations
default   [  53% ] 10/10 VUs  2m08.0s/4m00.0s
time="2025-12-16T22:20:02Z" level=info msg="Skipping test iteration - no AUTH_TOKEN provided" source=console

running (2m09.0s), 10/10 VUs, 171 complete and 0 interrupted iterations
default   [  54% ] 10/10 VUs  2m09.0s/4m00.0s
time="2025-12-16T22:20:03Z" level=info msg="Skipping test iteration - no AUTH_TOKEN provided" source=console

running (2m10.0s), 10/10 VUs, 172 complete and 0 interrupted iterations
default   [  54% ] 10/10 VUs  2m10.0s/4m00.0s
time="2025-12-16T22:20:04Z" level=info msg="Skipping test iteration - no AUTH_TOKEN provided" source=console
time="2025-12-16T22:20:04Z" level=info msg="Skipping test iteration - no AUTH_TOKEN provided" source=console
time="2025-12-16T22:20:04Z" level=info msg="Skipping test iteration - no AUTH_TOKEN provided" source=console
time="2025-12-16T22:20:04Z" level=info msg="Skipping test iteration - no AUTH_TOKEN provided" source=console

running (2m11.0s), 10/10 VUs, 176 complete and 0 interrupted iterations
default   [  55% ] 10/10 VUs  2m11.0s/4m00.0s
time="2025-12-16T22:20:05Z" level=info msg="Skipping test iteration - no AUTH_TOKEN provided" source=console

running (2m12.0s), 10/10 VUs, 177 complete and 0 interrupted iterations
default   [  55% ] 10/10 VUs  2m12.0s/4m00.0s
time="2025-12-16T22:20:06Z" level=info msg="Skipping test iteration - no AUTH_TOKEN provided" source=console
time="2025-12-16T22:20:06Z" level=info msg="Skipping test iteration - no AUTH_TOKEN provided" source=console
time="2025-12-16T22:20:06Z" level=info msg="Skipping test iteration - no AUTH_TOKEN provided" source=console

running (2m13.0s), 10/10 VUs, 180 complete and 0 interrupted iterations
default   [  55% ] 10/10 VUs  2m13.0s/4m00.0s
time="2025-12-16T22:20:07Z" level=info msg="Skipping test iteration - no AUTH_TOKEN provided" source=console

running (2m14.0s), 10/10 VUs, 181 complete and 0 interrupted iterations
default   [  56% ] 10/10 VUs  2m14.0s/4m00.0s
time="2025-12-16T22:20:08Z" level=info msg="Skipping test iteration - no AUTH_TOKEN provided" source=console

running (2m15.0s), 10/10 VUs, 182 complete and 0 interrupted iterations
default   [  56% ] 10/10 VUs  2m15.0s/4m00.0s
time="2025-12-16T22:20:09Z" level=info msg="Skipping test iteration - no AUTH_TOKEN provided" source=console
time="2025-12-16T22:20:09Z" level=info msg="Skipping test iteration - no AUTH_TOKEN provided" source=console
time="2025-12-16T22:20:09Z" level=info msg="Skipping test iteration - no AUTH_TOKEN provided" source=console
time="2025-12-16T22:20:09Z" level=info msg="Skipping test iteration - no AUTH_TOKEN provided" source=console

running (2m16.0s), 10/10 VUs, 186 complete and 0 interrupted iterations
default   [  57% ] 10/10 VUs  2m16.0s/4m00.0s
time="2025-12-16T22:20:10Z" level=info msg="Skipping test iteration - no AUTH_TOKEN provided" source=console

running (2m17.0s), 10/10 VUs, 187 complete and 0 interrupted iterations
default   [  57% ] 10/10 VUs  2m17.0s/4m00.0s
time="2025-12-16T22:20:11Z" level=info msg="Skipping test iteration - no AUTH_TOKEN provided" source=console
time="2025-12-16T22:20:11Z" level=info msg="Skipping test iteration - no AUTH_TOKEN provided" source=console
time="2025-12-16T22:20:11Z" level=info msg="Skipping test iteration - no AUTH_TOKEN provided" source=console

running (2m18.0s), 10/10 VUs, 190 complete and 0 interrupted iterations
default   [  57% ] 10/10 VUs  2m18.0s/4m00.0s
time="2025-12-16T22:20:12Z" level=info msg="Skipping test iteration - no AUTH_TOKEN provided" source=console

running (2m19.0s), 10/10 VUs, 191 complete and 0 interrupted iterations
default   [  58% ] 10/10 VUs  2m19.0s/4m00.0s
time="2025-12-16T22:20:13Z" level=info msg="Skipping test iteration - no AUTH_TOKEN provided" source=console

running (2m20.0s), 10/10 VUs, 192 complete and 0 interrupted iterations
default   [  58% ] 10/10 VUs  2m20.0s/4m00.0s
time="2025-12-16T22:20:14Z" level=info msg="Skipping test iteration - no AUTH_TOKEN provided" source=console
time="2025-12-16T22:20:14Z" level=info msg="Skipping test iteration - no AUTH_TOKEN provided" source=console
time="2025-12-16T22:20:14Z" level=info msg="Skipping test iteration - no AUTH_TOKEN provided" source=console
time="2025-12-16T22:20:14Z" level=info msg="Skipping test iteration - no AUTH_TOKEN provided" source=console

running (2m21.0s), 10/10 VUs, 196 complete and 0 interrupted iterations
default   [  59% ] 10/10 VUs  2m21.0s/4m00.0s
time="2025-12-16T22:20:15Z" level=info msg="Skipping test iteration - no AUTH_TOKEN provided" source=console

running (2m22.0s), 10/10 VUs, 197 complete and 0 interrupted iterations
default   [  59% ] 10/10 VUs  2m22.0s/4m00.0s
time="2025-12-16T22:20:16Z" level=info msg="Skipping test iteration - no AUTH_TOKEN provided" source=console
time="2025-12-16T22:20:16Z" level=info msg="Skipping test iteration - no AUTH_TOKEN provided" source=console
time="2025-12-16T22:20:16Z" level=info msg="Skipping test iteration - no AUTH_TOKEN provided" source=console

running (2m23.0s), 10/10 VUs, 200 complete and 0 interrupted iterations
default   [  60% ] 10/10 VUs  2m23.0s/4m00.0s
time="2025-12-16T22:20:17Z" level=info msg="Skipping test iteration - no AUTH_TOKEN provided" source=console

running (2m24.0s), 10/10 VUs, 201 complete and 0 interrupted iterations
default   [  60% ] 10/10 VUs  2m24.0s/4m00.0s
time="2025-12-16T22:20:18Z" level=info msg="Skipping test iteration - no AUTH_TOKEN provided" source=console

running (2m25.0s), 10/10 VUs, 202 complete and 0 interrupted iterations
default   [  60% ] 10/10 VUs  2m25.0s/4m00.0s
time="2025-12-16T22:20:19Z" level=info msg="Skipping test iteration - no AUTH_TOKEN provided" source=console
time="2025-12-16T22:20:19Z" level=info msg="Skipping test iteration - no AUTH_TOKEN provided" source=console
time="2025-12-16T22:20:19Z" level=info msg="Skipping test iteration - no AUTH_TOKEN provided" source=console
time="2025-12-16T22:20:19Z" level=info msg="Skipping test iteration - no AUTH_TOKEN provided" source=console

running (2m26.0s), 10/10 VUs, 206 complete and 0 interrupted iterations
default   [  61% ] 10/10 VUs  2m26.0s/4m00.0s
time="2025-12-16T22:20:20Z" level=info msg="Skipping test iteration - no AUTH_TOKEN provided" source=console

running (2m27.0s), 10/10 VUs, 207 complete and 0 interrupted iterations
default   [  61% ] 10/10 VUs  2m27.0s/4m00.0s
time="2025-12-16T22:20:21Z" level=info msg="Skipping test iteration - no AUTH_TOKEN provided" source=console
time="2025-12-16T22:20:21Z" level=info msg="Skipping test iteration - no AUTH_TOKEN provided" source=console
time="2025-12-16T22:20:21Z" level=info msg="Skipping test iteration - no AUTH_TOKEN provided" source=console

running (2m28.0s), 10/10 VUs, 210 complete and 0 interrupted iterations
default   [  62% ] 10/10 VUs  2m28.0s/4m00.0s
time="2025-12-16T22:20:22Z" level=info msg="Skipping test iteration - no AUTH_TOKEN provided" source=console

running (2m29.0s), 10/10 VUs, 211 complete and 0 interrupted iterations
default   [  62% ] 10/10 VUs  2m29.0s/4m00.0s
time="2025-12-16T22:20:23Z" level=info msg="Skipping test iteration - no AUTH_TOKEN provided" source=console

running (2m30.0s), 10/10 VUs, 212 complete and 0 interrupted iterations
default   [  62% ] 10/10 VUs  2m30.0s/4m00.0s
time="2025-12-16T22:20:24Z" level=info msg="Skipping test iteration - no AUTH_TOKEN provided" source=console
time="2025-12-16T22:20:24Z" level=info msg="Skipping test iteration - no AUTH_TOKEN provided" source=console
time="2025-12-16T22:20:24Z" level=info msg="Skipping test iteration - no AUTH_TOKEN provided" source=console
time="2025-12-16T22:20:24Z" level=info msg="Skipping test iteration - no AUTH_TOKEN provided" source=console

running (2m31.0s), 10/10 VUs, 216 complete and 0 interrupted iterations
default   [  63% ] 10/10 VUs  2m31.0s/4m00.0s
time="2025-12-16T22:20:25Z" level=info msg="Skipping test iteration - no AUTH_TOKEN provided" source=console

running (2m32.0s), 10/10 VUs, 217 complete and 0 interrupted iterations
default   [  63% ] 10/10 VUs  2m32.0s/4m00.0s
time="2025-12-16T22:20:26Z" level=info msg="Skipping test iteration - no AUTH_TOKEN provided" source=console
time="2025-12-16T22:20:26Z" level=info msg="Skipping test iteration - no AUTH_TOKEN provided" source=console
time="2025-12-16T22:20:26Z" level=info msg="Skipping test iteration - no AUTH_TOKEN provided" source=console

running (2m33.0s), 10/10 VUs, 220 complete and 0 interrupted iterations
default   [  64% ] 10/10 VUs  2m33.0s/4m00.0s
time="2025-12-16T22:20:27Z" level=info msg="Skipping test iteration - no AUTH_TOKEN provided" source=console

running (2m34.0s), 10/10 VUs, 221 complete and 0 interrupted iterations
default   [  64% ] 10/10 VUs  2m34.0s/4m00.0s
time="2025-12-16T22:20:28Z" level=info msg="Skipping test iteration - no AUTH_TOKEN provided" source=console

running (2m35.0s), 10/10 VUs, 222 complete and 0 interrupted iterations
default   [  65% ] 10/10 VUs  2m35.0s/4m00.0s
time="2025-12-16T22:20:29Z" level=info msg="Skipping test iteration - no AUTH_TOKEN provided" source=console
time="2025-12-16T22:20:29Z" level=info msg="Skipping test iteration - no AUTH_TOKEN provided" source=console
time="2025-12-16T22:20:29Z" level=info msg="Skipping test iteration - no AUTH_TOKEN provided" source=console
time="2025-12-16T22:20:29Z" level=info msg="Skipping test iteration - no AUTH_TOKEN provided" source=console

running (2m36.0s), 10/10 VUs, 226 complete and 0 interrupted iterations
default   [  65% ] 10/10 VUs  2m36.0s/4m00.0s
time="2025-12-16T22:20:30Z" level=info msg="Skipping test iteration - no AUTH_TOKEN provided" source=console

running (2m37.0s), 10/10 VUs, 227 complete and 0 interrupted iterations
default   [  65% ] 10/10 VUs  2m37.0s/4m00.0s
time="2025-12-16T22:20:31Z" level=info msg="Skipping test iteration - no AUTH_TOKEN provided" source=console
time="2025-12-16T22:20:31Z" level=info msg="Skipping test iteration - no AUTH_TOKEN provided" source=console
time="2025-12-16T22:20:31Z" level=info msg="Skipping test iteration - no AUTH_TOKEN provided" source=console

running (2m38.0s), 10/10 VUs, 230 complete and 0 interrupted iterations
default   [  66% ] 10/10 VUs  2m38.0s/4m00.0s
time="2025-12-16T22:20:32Z" level=info msg="Skipping test iteration - no AUTH_TOKEN provided" source=console

running (2m39.0s), 10/10 VUs, 231 complete and 0 interrupted iterations
default   [  66% ] 10/10 VUs  2m39.0s/4m00.0s
time="2025-12-16T22:20:33Z" level=info msg="Skipping test iteration - no AUTH_TOKEN provided" source=console

running (2m40.0s), 10/10 VUs, 232 complete and 0 interrupted iterations
default   [  67% ] 10/10 VUs  2m40.0s/4m00.0s
time="2025-12-16T22:20:34Z" level=info msg="Skipping test iteration - no AUTH_TOKEN provided" source=console
time="2025-12-16T22:20:34Z" level=info msg="Skipping test iteration - no AUTH_TOKEN provided" source=console
time="2025-12-16T22:20:34Z" level=info msg="Skipping test iteration - no AUTH_TOKEN provided" source=console
time="2025-12-16T22:20:34Z" level=info msg="Skipping test iteration - no AUTH_TOKEN provided" source=console

running (2m41.0s), 10/10 VUs, 236 complete and 0 interrupted iterations
default   [  67% ] 10/10 VUs  2m41.0s/4m00.0s
time="2025-12-16T22:20:35Z" level=info msg="Skipping test iteration - no AUTH_TOKEN provided" source=console

running (2m42.0s), 10/10 VUs, 237 complete and 0 interrupted iterations
default   [  67% ] 10/10 VUs  2m42.0s/4m00.0s
time="2025-12-16T22:20:36Z" level=info msg="Skipping test iteration - no AUTH_TOKEN provided" source=console
time="2025-12-16T22:20:36Z" level=info msg="Skipping test iteration - no AUTH_TOKEN provided" source=console
time="2025-12-16T22:20:36Z" level=info msg="Skipping test iteration - no AUTH_TOKEN provided" source=console

running (2m43.0s), 10/10 VUs, 240 complete and 0 interrupted iterations
default   [  68% ] 10/10 VUs  2m43.0s/4m00.0s
time="2025-12-16T22:20:37Z" level=info msg="Skipping test iteration - no AUTH_TOKEN provided" source=console

running (2m44.0s), 10/10 VUs, 241 complete and 0 interrupted iterations
default   [  68% ] 10/10 VUs  2m44.0s/4m00.0s
time="2025-12-16T22:20:38Z" level=info msg="Skipping test iteration - no AUTH_TOKEN provided" source=console

running (2m45.0s), 10/10 VUs, 242 complete and 0 interrupted iterations
default   [  69% ] 10/10 VUs  2m45.0s/4m00.0s
time="2025-12-16T22:20:39Z" level=info msg="Skipping test iteration - no AUTH_TOKEN provided" source=console
time="2025-12-16T22:20:39Z" level=info msg="Skipping test iteration - no AUTH_TOKEN provided" source=console
time="2025-12-16T22:20:39Z" level=info msg="Skipping test iteration - no AUTH_TOKEN provided" source=console
time="2025-12-16T22:20:39Z" level=info msg="Skipping test iteration - no AUTH_TOKEN provided" source=console

running (2m46.0s), 10/10 VUs, 246 complete and 0 interrupted iterations
default   [  69% ] 10/10 VUs  2m46.0s/4m00.0s
time="2025-12-16T22:20:40Z" level=info msg="Skipping test iteration - no AUTH_TOKEN provided" source=console

running (2m47.0s), 10/10 VUs, 247 complete and 0 interrupted iterations
default   [  70% ] 10/10 VUs  2m47.0s/4m00.0s
time="2025-12-16T22:20:41Z" level=info msg="Skipping test iteration - no AUTH_TOKEN provided" source=console
time="2025-12-16T22:20:41Z" level=info msg="Skipping test iteration - no AUTH_TOKEN provided" source=console
time="2025-12-16T22:20:41Z" level=info msg="Skipping test iteration - no AUTH_TOKEN provided" source=console

running (2m48.0s), 10/10 VUs, 250 complete and 0 interrupted iterations
default   [  70% ] 10/10 VUs  2m48.0s/4m00.0s
time="2025-12-16T22:20:42Z" level=info msg="Skipping test iteration - no AUTH_TOKEN provided" source=console

running (2m49.0s), 10/10 VUs, 251 complete and 0 interrupted iterations
default   [  70% ] 10/10 VUs  2m49.0s/4m00.0s
time="2025-12-16T22:20:43Z" level=info msg="Skipping test iteration - no AUTH_TOKEN provided" source=console

running (2m50.0s), 10/10 VUs, 252 complete and 0 interrupted iterations
default   [  71% ] 10/10 VUs  2m50.0s/4m00.0s
time="2025-12-16T22:20:44Z" level=info msg="Skipping test iteration - no AUTH_TOKEN provided" source=console
time="2025-12-16T22:20:44Z" level=info msg="Skipping test iteration - no AUTH_TOKEN provided" source=console
time="2025-12-16T22:20:44Z" level=info msg="Skipping test iteration - no AUTH_TOKEN provided" source=console
time="2025-12-16T22:20:44Z" level=info msg="Skipping test iteration - no AUTH_TOKEN provided" source=console

running (2m51.0s), 10/10 VUs, 256 complete and 0 interrupted iterations
default   [  71% ] 10/10 VUs  2m51.0s/4m00.0s
time="2025-12-16T22:20:45Z" level=info msg="Skipping test iteration - no AUTH_TOKEN provided" source=console

running (2m52.0s), 10/10 VUs, 257 complete and 0 interrupted iterations
default   [  72% ] 10/10 VUs  2m52.0s/4m00.0s
time="2025-12-16T22:20:46Z" level=info msg="Skipping test iteration - no AUTH_TOKEN provided" source=console
time="2025-12-16T22:20:46Z" level=info msg="Skipping test iteration - no AUTH_TOKEN provided" source=console
time="2025-12-16T22:20:46Z" level=info msg="Skipping test iteration - no AUTH_TOKEN provided" source=console

running (2m53.0s), 10/10 VUs, 260 complete and 0 interrupted iterations
default   [  72% ] 10/10 VUs  2m53.0s/4m00.0s
time="2025-12-16T22:20:47Z" level=info msg="Skipping test iteration - no AUTH_TOKEN provided" source=console

running (2m54.0s), 10/10 VUs, 261 complete and 0 interrupted iterations
default   [  72% ] 10/10 VUs  2m54.0s/4m00.0s
time="2025-12-16T22:20:48Z" level=info msg="Skipping test iteration - no AUTH_TOKEN provided" source=console

running (2m55.0s), 10/10 VUs, 262 complete and 0 interrupted iterations
default   [  73% ] 10/10 VUs  2m55.0s/4m00.0s
time="2025-12-16T22:20:49Z" level=info msg="Skipping test iteration - no AUTH_TOKEN provided" source=console
time="2025-12-16T22:20:49Z" level=info msg="Skipping test iteration - no AUTH_TOKEN provided" source=console
time="2025-12-16T22:20:49Z" level=info msg="Skipping test iteration - no AUTH_TOKEN provided" source=console
time="2025-12-16T22:20:49Z" level=info msg="Skipping test iteration - no AUTH_TOKEN provided" source=console

running (2m56.0s), 10/10 VUs, 266 complete and 0 interrupted iterations
default   [  73% ] 10/10 VUs  2m56.0s/4m00.0s
time="2025-12-16T22:20:50Z" level=info msg="Skipping test iteration - no AUTH_TOKEN provided" source=console

running (2m57.0s), 10/10 VUs, 267 complete and 0 interrupted iterations
default   [  74% ] 10/10 VUs  2m57.0s/4m00.0s
time="2025-12-16T22:20:51Z" level=info msg="Skipping test iteration - no AUTH_TOKEN provided" source=console
time="2025-12-16T22:20:51Z" level=info msg="Skipping test iteration - no AUTH_TOKEN provided" source=console
time="2025-12-16T22:20:51Z" level=info msg="Skipping test iteration - no AUTH_TOKEN provided" source=console

running (2m58.0s), 10/10 VUs, 270 complete and 0 interrupted iterations
default   [  74% ] 10/10 VUs  2m58.0s/4m00.0s
time="2025-12-16T22:20:52Z" level=info msg="Skipping test iteration - no AUTH_TOKEN provided" source=console

running (2m59.0s), 10/10 VUs, 271 complete and 0 interrupted iterations
default   [  75% ] 10/10 VUs  2m59.0s/4m00.0s
time="2025-12-16T22:20:53Z" level=info msg="Skipping test iteration - no AUTH_TOKEN provided" source=console

running (3m00.0s), 10/10 VUs, 272 complete and 0 interrupted iterations
default   [  75% ] 10/10 VUs  3m00.0s/4m00.0s
time="2025-12-16T22:20:54Z" level=info msg="Skipping test iteration - no AUTH_TOKEN provided" source=console
time="2025-12-16T22:20:54Z" level=info msg="Skipping test iteration - no AUTH_TOKEN provided" source=console
time="2025-12-16T22:20:54Z" level=info msg="Skipping test iteration - no AUTH_TOKEN provided" source=console
time="2025-12-16T22:20:54Z" level=info msg="Skipping test iteration - no AUTH_TOKEN provided" source=console

running (3m01.0s), 10/10 VUs, 276 complete and 0 interrupted iterations
default   [  75% ] 10/10 VUs  3m01.0s/4m00.0s
time="2025-12-16T22:20:55Z" level=info msg="Skipping test iteration - no AUTH_TOKEN provided" source=console

running (3m02.0s), 10/10 VUs, 277 complete and 0 interrupted iterations
default   [  76% ] 10/10 VUs  3m02.0s/4m00.0s
time="2025-12-16T22:20:56Z" level=info msg="Skipping test iteration - no AUTH_TOKEN provided" source=console
time="2025-12-16T22:20:56Z" level=info msg="Skipping test iteration - no AUTH_TOKEN provided" source=console
time="2025-12-16T22:20:56Z" level=info msg="Skipping test iteration - no AUTH_TOKEN provided" source=console

running (3m03.0s), 10/10 VUs, 280 complete and 0 interrupted iterations
default   [  76% ] 10/10 VUs  3m03.0s/4m00.0s
time="2025-12-16T22:20:57Z" level=info msg="Skipping test iteration - no AUTH_TOKEN provided" source=console

running (3m04.0s), 10/10 VUs, 281 complete and 0 interrupted iterations
default   [  77% ] 10/10 VUs  3m04.0s/4m00.0s
time="2025-12-16T22:20:58Z" level=info msg="Skipping test iteration - no AUTH_TOKEN provided" source=console

running (3m05.0s), 10/10 VUs, 282 complete and 0 interrupted iterations
default   [  77% ] 10/10 VUs  3m05.0s/4m00.0s
time="2025-12-16T22:20:59Z" level=info msg="Skipping test iteration - no AUTH_TOKEN provided" source=console
time="2025-12-16T22:20:59Z" level=info msg="Skipping test iteration - no AUTH_TOKEN provided" source=console
time="2025-12-16T22:20:59Z" level=info msg="Skipping test iteration - no AUTH_TOKEN provided" source=console
time="2025-12-16T22:20:59Z" level=info msg="Skipping test iteration - no AUTH_TOKEN provided" source=console

running (3m06.0s), 10/10 VUs, 286 complete and 0 interrupted iterations
default   [  77% ] 10/10 VUs  3m06.0s/4m00.0s
time="2025-12-16T22:21:00Z" level=info msg="Skipping test iteration - no AUTH_TOKEN provided" source=console

running (3m07.0s), 10/10 VUs, 287 complete and 0 interrupted iterations
default   [  78% ] 10/10 VUs  3m07.0s/4m00.0s
time="2025-12-16T22:21:01Z" level=info msg="Skipping test iteration - no AUTH_TOKEN provided" source=console
time="2025-12-16T22:21:01Z" level=info msg="Skipping test iteration - no AUTH_TOKEN provided" source=console
time="2025-12-16T22:21:01Z" level=info msg="Skipping test iteration - no AUTH_TOKEN provided" source=console

running (3m08.0s), 10/10 VUs, 290 complete and 0 interrupted iterations
default   [  78% ] 10/10 VUs  3m08.0s/4m00.0s
time="2025-12-16T22:21:02Z" level=info msg="Skipping test iteration - no AUTH_TOKEN provided" source=console

running (3m09.0s), 10/10 VUs, 291 complete and 0 interrupted iterations
default   [  79% ] 10/10 VUs  3m09.0s/4m00.0s
time="2025-12-16T22:21:03Z" level=info msg="Skipping test iteration - no AUTH_TOKEN provided" source=console

running (3m10.0s), 10/10 VUs, 292 complete and 0 interrupted iterations
default   [  79% ] 10/10 VUs  3m10.0s/4m00.0s
time="2025-12-16T22:21:04Z" level=info msg="Skipping test iteration - no AUTH_TOKEN provided" source=console
time="2025-12-16T22:21:04Z" level=info msg="Skipping test iteration - no AUTH_TOKEN provided" source=console
time="2025-12-16T22:21:04Z" level=info msg="Skipping test iteration - no AUTH_TOKEN provided" source=console
time="2025-12-16T22:21:04Z" level=info msg="Skipping test iteration - no AUTH_TOKEN provided" source=console

running (3m11.0s), 10/10 VUs, 296 complete and 0 interrupted iterations
default   [  80% ] 10/10 VUs  3m11.0s/4m00.0s
time="2025-12-16T22:21:05Z" level=info msg="Skipping test iteration - no AUTH_TOKEN provided" source=console

running (3m12.0s), 10/10 VUs, 297 complete and 0 interrupted iterations
default   [  80% ] 10/10 VUs  3m12.0s/4m00.0s
time="2025-12-16T22:21:06Z" level=info msg="Skipping test iteration - no AUTH_TOKEN provided" source=console
time="2025-12-16T22:21:06Z" level=info msg="Skipping test iteration - no AUTH_TOKEN provided" source=console
time="2025-12-16T22:21:06Z" level=info msg="Skipping test iteration - no AUTH_TOKEN provided" source=console

running (3m13.0s), 10/10 VUs, 300 complete and 0 interrupted iterations
default   [  80% ] 10/10 VUs  3m13.0s/4m00.0s
time="2025-12-16T22:21:07Z" level=info msg="Skipping test iteration - no AUTH_TOKEN provided" source=console

running (3m14.0s), 10/10 VUs, 301 complete and 0 interrupted iterations
default   [  81% ] 10/10 VUs  3m14.0s/4m00.0s
time="2025-12-16T22:21:08Z" level=info msg="Skipping test iteration - no AUTH_TOKEN provided" source=console

running (3m15.0s), 10/10 VUs, 302 complete and 0 interrupted iterations
default   [  81% ] 10/10 VUs  3m15.0s/4m00.0s
time="2025-12-16T22:21:09Z" level=info msg="Skipping test iteration - no AUTH_TOKEN provided" source=console
time="2025-12-16T22:21:09Z" level=info msg="Skipping test iteration - no AUTH_TOKEN provided" source=console
time="2025-12-16T22:21:09Z" level=info msg="Skipping test iteration - no AUTH_TOKEN provided" source=console
time="2025-12-16T22:21:09Z" level=info msg="Skipping test iteration - no AUTH_TOKEN provided" source=console

running (3m16.0s), 10/10 VUs, 306 complete and 0 interrupted iterations
default   [  82% ] 10/10 VUs  3m16.0s/4m00.0s
time="2025-12-16T22:21:10Z" level=info msg="Skipping test iteration - no AUTH_TOKEN provided" source=console

running (3m17.0s), 10/10 VUs, 307 complete and 0 interrupted iterations
default   [  82% ] 10/10 VUs  3m17.0s/4m00.0s
time="2025-12-16T22:21:11Z" level=info msg="Skipping test iteration - no AUTH_TOKEN provided" source=console
time="2025-12-16T22:21:11Z" level=info msg="Skipping test iteration - no AUTH_TOKEN provided" source=console
time="2025-12-16T22:21:11Z" level=info msg="Skipping test iteration - no AUTH_TOKEN provided" source=console

running (3m18.0s), 10/10 VUs, 310 complete and 0 interrupted iterations
default   [  82% ] 10/10 VUs  3m18.0s/4m00.0s
time="2025-12-16T22:21:12Z" level=info msg="Skipping test iteration - no AUTH_TOKEN provided" source=console

running (3m19.0s), 10/10 VUs, 311 complete and 0 interrupted iterations
default   [  83% ] 10/10 VUs  3m19.0s/4m00.0s
time="2025-12-16T22:21:13Z" level=info msg="Skipping test iteration - no AUTH_TOKEN provided" source=console

running (3m20.0s), 10/10 VUs, 312 complete and 0 interrupted iterations
default   [  83% ] 10/10 VUs  3m20.0s/4m00.0s
time="2025-12-16T22:21:14Z" level=info msg="Skipping test iteration - no AUTH_TOKEN provided" source=console
time="2025-12-16T22:21:14Z" level=info msg="Skipping test iteration - no AUTH_TOKEN provided" source=console
time="2025-12-16T22:21:14Z" level=info msg="Skipping test iteration - no AUTH_TOKEN provided" source=console
time="2025-12-16T22:21:14Z" level=info msg="Skipping test iteration - no AUTH_TOKEN provided" source=console

running (3m21.0s), 10/10 VUs, 316 complete and 0 interrupted iterations
default   [  84% ] 10/10 VUs  3m21.0s/4m00.0s
time="2025-12-16T22:21:15Z" level=info msg="Skipping test iteration - no AUTH_TOKEN provided" source=console

running (3m22.0s), 10/10 VUs, 317 complete and 0 interrupted iterations
default   [  84% ] 10/10 VUs  3m22.0s/4m00.0s
time="2025-12-16T22:21:16Z" level=info msg="Skipping test iteration - no AUTH_TOKEN provided" source=console
time="2025-12-16T22:21:16Z" level=info msg="Skipping test iteration - no AUTH_TOKEN provided" source=console
time="2025-12-16T22:21:16Z" level=info msg="Skipping test iteration - no AUTH_TOKEN provided" source=console

running (3m23.0s), 10/10 VUs, 320 complete and 0 interrupted iterations
default   [  85% ] 10/10 VUs  3m23.0s/4m00.0s
time="2025-12-16T22:21:17Z" level=info msg="Skipping test iteration - no AUTH_TOKEN provided" source=console

running (3m24.0s), 10/10 VUs, 321 complete and 0 interrupted iterations
default   [  85% ] 10/10 VUs  3m24.0s/4m00.0s
time="2025-12-16T22:21:18Z" level=info msg="Skipping test iteration - no AUTH_TOKEN provided" source=console

running (3m25.0s), 10/10 VUs, 322 complete and 0 interrupted iterations
default   [  85% ] 10/10 VUs  3m25.0s/4m00.0s
time="2025-12-16T22:21:19Z" level=info msg="Skipping test iteration - no AUTH_TOKEN provided" source=console
time="2025-12-16T22:21:19Z" level=info msg="Skipping test iteration - no AUTH_TOKEN provided" source=console
time="2025-12-16T22:21:19Z" level=info msg="Skipping test iteration - no AUTH_TOKEN provided" source=console
time="2025-12-16T22:21:19Z" level=info msg="Skipping test iteration - no AUTH_TOKEN provided" source=console

running (3m26.0s), 10/10 VUs, 326 complete and 0 interrupted iterations
default   [  86% ] 10/10 VUs  3m26.0s/4m00.0s
time="2025-12-16T22:21:20Z" level=info msg="Skipping test iteration - no AUTH_TOKEN provided" source=console

running (3m27.0s), 10/10 VUs, 327 complete and 0 interrupted iterations
default   [  86% ] 10/10 VUs  3m27.0s/4m00.0s
time="2025-12-16T22:21:21Z" level=info msg="Skipping test iteration - no AUTH_TOKEN provided" source=console
time="2025-12-16T22:21:21Z" level=info msg="Skipping test iteration - no AUTH_TOKEN provided" source=console
time="2025-12-16T22:21:21Z" level=info msg="Skipping test iteration - no AUTH_TOKEN provided" source=console

running (3m28.0s), 10/10 VUs, 330 complete and 0 interrupted iterations
default   [  87% ] 10/10 VUs  3m28.0s/4m00.0s
time="2025-12-16T22:21:22Z" level=info msg="Skipping test iteration - no AUTH_TOKEN provided" source=console

running (3m29.0s), 10/10 VUs, 331 complete and 0 interrupted iterations
default   [  87% ] 10/10 VUs  3m29.0s/4m00.0s
time="2025-12-16T22:21:23Z" level=info msg="Skipping test iteration - no AUTH_TOKEN provided" source=console

running (3m30.0s), 10/10 VUs, 332 complete and 0 interrupted iterations
default   [  87% ] 10/10 VUs  3m30.0s/4m00.0s
time="2025-12-16T22:21:24Z" level=info msg="Skipping test iteration - no AUTH_TOKEN provided" source=console
time="2025-12-16T22:21:24Z" level=info msg="Skipping test iteration - no AUTH_TOKEN provided" source=console
time="2025-12-16T22:21:24Z" level=info msg="Skipping test iteration - no AUTH_TOKEN provided" source=console
time="2025-12-16T22:21:24Z" level=info msg="Skipping test iteration - no AUTH_TOKEN provided" source=console

running (3m31.0s), 10/10 VUs, 336 complete and 0 interrupted iterations
default   [  88% ] 10/10 VUs  3m31.0s/4m00.0s
time="2025-12-16T22:21:25Z" level=info msg="Skipping test iteration - no AUTH_TOKEN provided" source=console

running (3m32.0s), 10/10 VUs, 337 complete and 0 interrupted iterations
default   [  88% ] 10/10 VUs  3m32.0s/4m00.0s
time="2025-12-16T22:21:26Z" level=info msg="Skipping test iteration - no AUTH_TOKEN provided" source=console
time="2025-12-16T22:21:26Z" level=info msg="Skipping test iteration - no AUTH_TOKEN provided" source=console
time="2025-12-16T22:21:26Z" level=info msg="Skipping test iteration - no AUTH_TOKEN provided" source=console

running (3m33.0s), 10/10 VUs, 340 complete and 0 interrupted iterations
default   [  89% ] 10/10 VUs  3m33.0s/4m00.0s
time="2025-12-16T22:21:27Z" level=info msg="Skipping test iteration - no AUTH_TOKEN provided" source=console

running (3m34.0s), 10/10 VUs, 341 complete and 0 interrupted iterations
default   [  89% ] 10/10 VUs  3m34.0s/4m00.0s
time="2025-12-16T22:21:28Z" level=info msg="Skipping test iteration - no AUTH_TOKEN provided" source=console

running (3m35.0s), 10/10 VUs, 342 complete and 0 interrupted iterations
default   [  90% ] 10/10 VUs  3m35.0s/4m00.0s
time="2025-12-16T22:21:29Z" level=info msg="Skipping test iteration - no AUTH_TOKEN provided" source=console
time="2025-12-16T22:21:29Z" level=info msg="Skipping test iteration - no AUTH_TOKEN provided" source=console
time="2025-12-16T22:21:29Z" level=info msg="Skipping test iteration - no AUTH_TOKEN provided" source=console

running (3m36.0s), 09/10 VUs, 346 complete and 0 interrupted iterations
default   [  90% ] 09/10 VUs  3m36.0s/4m00.0s
time="2025-12-16T22:21:30Z" level=info msg="Skipping test iteration - no AUTH_TOKEN provided" source=console

running (3m37.0s), 09/10 VUs, 347 complete and 0 interrupted iterations
default   [  90% ] 09/10 VUs  3m37.0s/4m00.0s
time="2025-12-16T22:21:31Z" level=info msg="Skipping test iteration - no AUTH_TOKEN provided" source=console
time="2025-12-16T22:21:31Z" level=info msg="Skipping test iteration - no AUTH_TOKEN provided" source=console
time="2025-12-16T22:21:31Z" level=info msg="Skipping test iteration - no AUTH_TOKEN provided" source=console

running (3m38.0s), 09/10 VUs, 350 complete and 0 interrupted iterations
default   [  91% ] 09/10 VUs  3m38.0s/4m00.0s

running (3m39.0s), 08/10 VUs, 351 complete and 0 interrupted iterations
default   [  91% ] 08/10 VUs  3m39.0s/4m00.0s
time="2025-12-16T22:21:33Z" level=info msg="Skipping test iteration - no AUTH_TOKEN provided" source=console

running (3m40.0s), 08/10 VUs, 352 complete and 0 interrupted iterations
default   [  92% ] 08/10 VUs  3m40.0s/4m00.0s
time="2025-12-16T22:21:34Z" level=info msg="Skipping test iteration - no AUTH_TOKEN provided" source=console
time="2025-12-16T22:21:34Z" level=info msg="Skipping test iteration - no AUTH_TOKEN provided" source=console
time="2025-12-16T22:21:34Z" level=info msg="Skipping test iteration - no AUTH_TOKEN provided" source=console

running (3m41.0s), 08/10 VUs, 355 complete and 0 interrupted iterations
default   [  92% ] 08/10 VUs  3m41.0s/4m00.0s

running (3m42.0s), 07/10 VUs, 356 complete and 0 interrupted iterations
default   [  92% ] 07/10 VUs  3m42.0s/4m00.0s
time="2025-12-16T22:21:36Z" level=info msg="Skipping test iteration - no AUTH_TOKEN provided" source=console
time="2025-12-16T22:21:36Z" level=info msg="Skipping test iteration - no AUTH_TOKEN provided" source=console
time="2025-12-16T22:21:36Z" level=info msg="Skipping test iteration - no AUTH_TOKEN provided" source=console

running (3m43.0s), 07/10 VUs, 359 complete and 0 interrupted iterations
default   [  93% ] 07/10 VUs  3m43.0s/4m00.0s

running (3m44.0s), 07/10 VUs, 359 complete and 0 interrupted iterations
default   [  93% ] 07/10 VUs  3m44.0s/4m00.0s

running (3m45.0s), 06/10 VUs, 360 complete and 0 interrupted iterations
default   [  94% ] 06/10 VUs  3m45.0s/4m00.0s
time="2025-12-16T22:21:39Z" level=info msg="Skipping test iteration - no AUTH_TOKEN provided" source=console
time="2025-12-16T22:21:39Z" level=info msg="Skipping test iteration - no AUTH_TOKEN provided" source=console
time="2025-12-16T22:21:39Z" level=info msg="Skipping test iteration - no AUTH_TOKEN provided" source=console

running (3m46.0s), 06/10 VUs, 363 complete and 0 interrupted iterations
default   [  94% ] 06/10 VUs  3m46.0s/4m00.0s

running (3m47.0s), 06/10 VUs, 363 complete and 0 interrupted iterations
default   [  95% ] 06/10 VUs  3m47.0s/4m00.0s
time="2025-12-16T22:21:41Z" level=info msg="Skipping test iteration - no AUTH_TOKEN provided" source=console
time="2025-12-16T22:21:41Z" level=info msg="Skipping test iteration - no AUTH_TOKEN provided" source=console

running (3m48.0s), 05/10 VUs, 366 complete and 0 interrupted iterations
default   [  95% ] 05/10 VUs  3m48.0s/4m00.0s

running (3m49.0s), 05/10 VUs, 366 complete and 0 interrupted iterations
default   [  95% ] 05/10 VUs  3m49.0s/4m00.0s

running (3m50.0s), 05/10 VUs, 366 complete and 0 interrupted iterations
default   [  96% ] 05/10 VUs  3m50.0s/4m00.0s
time="2025-12-16T22:21:44Z" level=info msg="Skipping test iteration - no AUTH_TOKEN provided" source=console
time="2025-12-16T22:21:44Z" level=info msg="Skipping test iteration - no AUTH_TOKEN provided" source=console

running (3m51.0s), 04/10 VUs, 369 complete and 0 interrupted iterations
default   [  96% ] 04/10 VUs  3m51.0s/4m00.0s

running (3m52.0s), 04/10 VUs, 369 complete and 0 interrupted iterations
default   [  97% ] 04/10 VUs  3m52.0s/4m00.0s
time="2025-12-16T22:21:46Z" level=info msg="Skipping test iteration - no AUTH_TOKEN provided" source=console

running (3m53.0s), 03/10 VUs, 371 complete and 0 interrupted iterations
default   [  97% ] 03/10 VUs  3m53.0s/4m00.0s

running (3m54.0s), 03/10 VUs, 371 complete and 0 interrupted iterations
default   [  97% ] 03/10 VUs  3m54.0s/4m00.0s

running (3m55.0s), 03/10 VUs, 371 complete and 0 interrupted iterations
default   [  98% ] 03/10 VUs  3m55.0s/4m00.0s
time="2025-12-16T22:21:49Z" level=info msg="Skipping test iteration - no AUTH_TOKEN provided" source=console

running (3m56.0s), 02/10 VUs, 373 complete and 0 interrupted iterations
default   [  98% ] 02/10 VUs  3m56.0s/4m00.0s

running (3m57.0s), 02/10 VUs, 373 complete and 0 interrupted iterations
default   [  99% ] 02/10 VUs  3m57.0s/4m00.0s

running (3m58.0s), 01/10 VUs, 374 complete and 0 interrupted iterations
default   [  99% ] 01/10 VUs  3m58.0s/4m00.0s

running (3m59.0s), 01/10 VUs, 374 complete and 0 interrupted iterations
default   [ 100% ] 01/10 VUs  3m59.0s/4m00.0s

running (4m00.0s), 01/10 VUs, 374 complete and 0 interrupted iterations
default   [ 100% ] 01/10 VUs  4m00.0s/4m00.0s
time="2025-12-16T22:21:54Z" level=info msg="Clip submission load test completed" source=console


  █ THRESHOLDS 

    errors
    ✓ 'rate<0.05' rate=0.00%

    http_req_duration{endpoint:list_submissions}
    ✓ 'p(95)<50' p(95)=0s
    ✓ 'p(99)<100' p(99)=0s

    http_req_duration{endpoint:submission_stats}
    ✓ 'p(95)<30' p(95)=0s
    ✓ 'p(99)<75' p(99)=0s

    http_req_duration{endpoint:submit_clip}
    ✓ 'p(95)<200' p(95)=0s
    ✓ 'p(99)<500' p(99)=0s

    http_req_failed{endpoint:list_submissions}
    ✓ 'rate<0.01' rate=0.00%


  █ TOTAL RESULTS 

    CUSTOM
    errors............................: 0.00% 0 out of 0

    HTTP
    http_req_duration.................: avg=0s min=0s med=0s max=0s p(90)=0s p(95)=0s
      { endpoint:list_submissions }...: avg=0s min=0s med=0s max=0s p(90)=0s p(95)=0s
      { endpoint:submission_stats }...: avg=0s min=0s med=0s max=0s p(90)=0s p(95)=0s
      { endpoint:submit_clip }........: avg=0s min=0s med=0s max=0s p(90)=0s p(95)=0s
    http_req_failed...................: 0.00% 0 out of 0
      { endpoint:list_submissions }...: 0.00% 0 out of 0

    EXECUTION
    iteration_duration................: avg=5s min=5s med=5s max=5s p(90)=5s p(95)=5s
    iterations........................: 375   1.562287/s
    vus...............................: 1     min=1      max=10
    vus_max...........................: 10    min=10     max=10

    NETWORK
    data_received.....................: 0 B   0 B/s
    data_sent.........................: 0 B   0 B/s




running (4m00.0s), 00/10 VUs, 375 complete and 0 interrupted iterations
default ✓ [ 100% ] 00/10 VUs  4m0s
